"","AU","AB","DI","SN","SO","PP","TI","VL","PY","DB","J9","TC","CR","C1","AU_UN","SR_FULL","SR"
"LEI Y, 2021, J. Med. Internet Res.","LEI Y;XU S;ZHOU L","BACKGROUND: ONLINE HEALTH COMMUNITIES (OHCS) HAVE INCREASINGLY GAINED TRACTION WITH PATIENTS, CAREGIVERS, AND SUPPORTERS GLOBALLY. CHINESE OHCS ARE NO EXCEPTION. HOWEVER, USER-GENERATED CONTENT (UGC) AND THE ASSOCIATED USER BEHAVIORS IN CHINESE OHCS ARE LARGELY UNDEREXPLORED AND RARELY ANALYZED SYSTEMATICALLY, FORFEITING VALUABLE OPPORTUNITIES FOR OPTIMIZING TREATMENT DESIGN AND CARE DELIVERY WITH INSIGHTS GAINED FROM OHCS. OBJECTIVE: THIS STUDY AIMED TO REVEAL BOTH THE SHARED AND DISTINCT CHARACTERISTICS OF 2 POPULAR OHCS IN CHINA BY SYSTEMATICALLY AND COMPREHENSIVELY ANALYZING THEIR UGC AND THE ASSOCIATED USER BEHAVIORS. METHODS: WE CONCENTRATED ON STUDYING THE LUNG CANCER FORUM (LCF) AND BREAST CANCER FORUM (BCF) ON MIJIAN, AND THE DIABETES CONSULTATION FORUM (DCF) ON SWEET HOME, BECAUSE OF THE IMPORTANCE OF THE 3 DISEASES AMONG CHINESE PATIENTS AND THEIR PREVALENCE ON CHINESE OHCS IN GENERAL. OUR ANALYSIS EXPLORED THE KEY USER ACTIVITIES, SMALL-WORLD EFFECT, AND SCALE-FREE CHARACTERISTICS OF EACH SOCIAL NETWORK. WE EXAMINED THE UGC OF THESE FORUMS COMPREHENSIVELY AND ADOPTED THE WEIGHTED KNOWLEDGE NETWORK TECHNIQUE TO DISCOVER SALIENT TOPICS AND LATENT RELATIONS AMONG THESE TOPICS ON EACH FORUM. FINALLY, WE DISCUSSED THE PUBLIC HEALTH IMPLICATIONS OF OUR ANALYSIS FINDINGS. RESULTS: OUR ANALYSIS SHOWED THAT THE NUMBER OF READS PER THREAD ON EACH FORUM FOLLOWED GAMMA DISTRIBUTION (H-L=0, H-B=0, AND H-D=0); THE NUMBER OF REPLIES ON EACH FORUM FOLLOWED EXPONENTIAL DISTRIBUTION (ADJUSTED R-L(2) =0.946, ADJUSTED R-B(2)=0.958, AND ADJUSTED R-D(2) =0.971); AND THE NUMBER OF THREADS A USER IS INVOLVED WITH (ADJUSTED R-L(2)=0.978, ADJUSTED R-B(2)=0.964, AND ADJUSTED R-D(2)=0.970), THE NUMBER OF FOLLOWERS OF A USER (ADJUSTED R-L(2)=0.989, ADJUSTED R-B(2)=0.962, AND ADJUSTED R-D(2)=0.990), AND A USER'S DEGREES (ADJUSTED R-L(2)=0.997, ADJUSTED R-B(2)=0.994, AND ADJUSTED R-D(2)=0.968) ALL FOLLOWED POWER-LAW DISTRIBUTION. THE STUDY FURTHER REVEALED THAT USERS ARE GENERALLY MORE ACTIVE DURING WEEKDAYS, AS COMMONLY WITNESSED IN ALL 3 FORUMS. IN PARTICULAR, THE LCF AND DCF EXHIBITED HIGH TEMPORAL SIMILARITY (RHO=0.927; P<.001) IN TERMS OF THE RELATIVE THREAD POSTING FREQUENCIES DURING EACH HOUR OF THE DAY. BESIDES, THE STUDY SHOWED THAT ALL 3 FORUMS EXHIBITED THE SMALL-WORLD EFFECT (MEAN SIGMA(L)=517.15, MEAN SIGMA(B)=275.23, AND MEAN SIGMA(D)=525.18) AND SCALE-FREE CHARACTERISTICS, WHILE THE GLOBAL CLUSTERING COEFFICIENTS WERE LOWER THAN THOSE OF COUNTERPART INTERNATIONAL OHCS. THE STUDY ALSO DISCOVERED SEVERAL HOT TOPICS COMMONLY SHARED AMONG THE 3 DISEASE FORUMS, SUCH AS DISEASE TREATMENT, DISEASE EXAMINATION, AND DIAGNOSIS. IN PARTICULAR, THE STUDY FOUND THAT AFTER THE OUTBREAK OF COVID-19, USERS ON THE LCF AND BCF WERE MUCH MORE LIKELY TO BRING UP COVID-19-RELATED ISSUES WHILE DISCUSSING THEIR MEDICAL ISSUES. CONCLUSIONS: UGC AND RELATED ONLINE USER BEHAVIORS IN CHINESE OHCS CAN BE LEVERAGED AS IMPORTANT SOURCES OF INFORMATION TO GAIN INSIGHTS REGARDING INDIVIDUAL AND POPULATION HEALTH CONDITIONS. EFFECTIVE AND TIMELY MINING AND UTILIZATION OF SUCH CONTENT CAN CONTINUOUSLY PROVIDE VALUABLE FIRSTHAND CLUES FOR ENHANCING THE SITUATIONAL AWARENESS OF HEALTH PROVIDERS AND POLICYMAKERS.","10.2196/19183","1438-8871","JOURNAL OF MEDICAL INTERNET RESEARCH",NA,"USER BEHAVIORS AND USERGENERATED CONTENT IN CHINESE ONLINE HEALTH COMMUNITIES COMPARATIVE STUDY","23",2021,"ISI","J. Med. Internet Res.",0,"none",NA,NA,"LEI Y, 2021, J. Med. Internet Res.","LEI Y, 2021, J. Med. Internet Res."
"VANDERWAAL K, 2020, Prev. Vet. Med.","VANDERWAAL K;PAPLOSKI I;MAKAU C","ANALYSES OF LIVESTOCK MOVEMENT NETWORKS HAS BECOME KEY TO UNDERSTANDING AN INDUSTRY'S VULNERABILITY TO INFECTIOUS DISEASE SPREAD AND FOR IDENTIFYING FARMS THAT PLAY DISPROPORTIONATE ROLES IN PATHOGEN DISSEMINATION. IN ADDITION TO ANIMAL MOVEMENTS, MANY PATHOGENS CAN SPREAD BETWEEN FARMS VIA MECHANISMS MEDIATED BY SPATIAL PROXIMITY. HETEROGENEITIES IN CONTACT PATTERNS BASED ON SPATIAL PROXIMITY ARE LESS COMMONLY CONSIDERED IN NETWORK STUDIES, AND STUDIES THAT JOINTLY CONSIDER SPATIAL CONNECTIVITY AND ANIMAL MOVEMENT ARE RARE. THE OBJECTIVE OF THIS STUDY WAS TO DETERMINE THE EXTENT TO WHICH MOVEMENT VERSUS SPATIAL PROXIMITY NETWORKS DETERMINE THE DISTRIBUTION OF AN ECONOMICALLY IMPORTANT ENDEMIC VIRUS, PORCINE REPRODUCTIVE AND RESPIRATORY SYNDROME VIRUS (PRRSV), WITHIN A SWINE-DENSE REGION OF THE U.S. PRRSV CAN BE CLASSIFIED INTO NUMEROUS PHYLOGENETIC LINEAGES. SUCH DATA CAN BE USED TO BETTER RESOLVE BETWEEN-FARM INFECTION CHAINS AND ELUCIDATE TYPES OF CONTACT MOST ASSOCIATED WITH TRANSMISSION. HERE, WE CONSTRUCT MOVEMENT AND SPATIAL PROXIMITY NETWORKS; FARMS WITHIN THE NETWORKS WERE CLASSIFIED AS CASES IF A GIVEN PRRSV LINEAGE HAD BEEN RECOVERED AT LEAST ONCE IN A YEAR FOR EACH OF THREE YEARS ANALYZED. WE EVALUATED SIX LINEAGES AND SUB-LINEAGES ACROSS THREE YEARS, AND EVALUATED THE EPIDEMIOLOGICAL RELEVANCE OF EACH NETWORK BY APPLYING NETWORK K-TESTS TO STATISTICALLY EVALUATE WHETHER THE PATTERN OF CASE OCCURRENCE WITHIN THE NETWORK WAS CONSISTENT WITH TRANSMISSION VIA NETWORK LINKAGES. OUR RESULTS INDICATED THAT ANIMAL MOVEMENTS, NOT LOCAL AREA SPREAD, PLAY A DOMINANT ROLE IN SHAPING TRANSMISSION PATHWAYS, THOUGH THERE WERE DIFFERENCES AMONGST LINEAGES. THE MEDIAN NUMBER OF CASE FARMS INTER-LINKED VIA ANIMAL MOVEMENTS WAS APPROXIMATELY 4.1X HIGHER THAN RANDOM EXPECTATIONS (RANGE: 1.7-13.7; P < 0.05, NETWORK K-TEST), WHEREAS THIS MEASURE WAS ONLY 2.7X HIGHER THAN RANDOM EXPECTATIONS FOR FARMS LINKED VIA SPATIAL PROXIMITY (RANGE: 1.3-5.4; P < 0.05, NETWORK K-TEST). FOR SPATIAL PROXIMITY NETWORKS, CONTACT BASED ON PROXIMITIES OF < 5 KM APPEARED TO HAVE GREATER EPIDEMIOLOGICAL RELEVANCE THAN LONGER DISTANCES, LIKELY RELATED TO DIMINISHING PROBABILITIES OF LOCAL AREA SPREAD AT GREATER DISTANCES. HOWEVER, THE GREATER OVERALL LEVELS OF CONNECTIVITY OF THE SPATIAL NETWORK COMPARED TO THE MOVEMENT NETWORK HIGHLIGHTS THE VULNERABILITY OF PIG POPULATIONS TO WIDE-SPREAD TRANSMISSION VIA THIS ROUTE. BY COMBINING GENETIC DATA WITH NETWORK ANALYSIS, THIS RESEARCH ADVANCES OUR UNDERSTANDING OF DYNAMICS OF BETWEEN-FARM SPREAD OF PRRSV, HELPS ESTABLISH THE RELATIVE IMPORTANCE OF TRANSMISSION VIA ANIMAL MOVEMENTS VERSUS LOCAL AREA SPREAD, AND HIGHLIGHTS THE POTENTIAL FOR TARGETED CONTROL STRATEGIES BASED UPON HETEROGENEITIES IN NETWORK CONNECTIVITY.","10.1016/j.prevetmed.2020.104977","0167-5877","PREVENTIVE VETERINARY MEDICINE",NA,"CONTRASTING ANIMAL MOVEMENT AND SPATIAL CONNECTIVITY NETWORKS IN SHAPING TRANSMISSION PATHWAYS OF A GENETICALLY DIVERSE VIRUS","178",2020,"ISI","Prev. Vet. Med.",0,"none",NA,NA,"VANDERWAAL K, 2020, Prev. Vet. Med.","VANDERWAAL K, 2020, Prev. Vet. Med."
"BOUCHOUAR E, 2023, Can. J. Public Health-Rev. Can. Sante Publique","BOUCHOUAR E;LEVINE M;ILEKA-PRIOUZEAU S;FU A;SALEMI J","OBJECTIVESTHIS STUDY AIMED TO APPLY A SYSTEMS THINKING APPROACH TO EXPLORE FACTORS INFLUENCING THE DETECTION OF EMERGING DRUG TRENDS IN CANADA'S PROVINCES AND TERRITORIES TO BETTER UNDERSTAND HOW THE LOCAL CONTEXT CAN INFLUENCE THE DESIGN AND PERFORMANCE OF A PAN-CANADIAN (I.E., NATIONAL) SUBSTANCE USE EARLY WARNING SYSTEM (EWS). THIS STUDY ALSO PRESENTS A SET OF ACTIONABLE RECOMMENDATIONS ARISING FROM THE RESULTS.METHODOLOGY AND METHODSSEMI-STRUCTURED INTERVIEWS WERE CONDUCTED WITH 13 PURPOSIVELY RECRUITED MEDICAL OFFICERS OF HEALTH AND EPIDEMIOLOGISTS FROM ACROSS CANADA WORKING IN THE FIELD OF SUBSTANCE USE. THEMATIC AND SOCIAL NETWORK ANALYSIS GUIDED BY THE SOCIO-TECHNICAL SYSTEMS FRAMEWORK WERE SUBSEQUENTLY EMPLOYED.RESULTSBARRIERS AND FACILITATORS FOR DETECTING EMERGING DRUG TRENDS IN PROVINCES AND TERRITORIES ARE A PRODUCT OF THE COLLECTIVE LINKAGES AND INTERACTIONS BETWEEN SOCIAL (OBJECTIVES, PEOPLE, CULTURE), TECHNICAL (TOOLS, PRACTICES, INFRASTRUCTURE), AND EXTERNAL ENVIRONMENTAL (FINANCIAL, REGULATORY FRAMEWORKS, STAKEHOLDERS) FACTORS. SHORTCOMINGS IN SEVERAL OF THESE AREAS SHAPED THE SYSTEM'S BEHAVIOUR AND TOGETHER CONTRIBUTED TO FRAGMENTED OPERATIONS THAT LACKED STRATEGIC FOCUS, POORLY DESIGNED CROSS-SECTOR PARTNERSHIPS, AND UNACTIONABLE INFORMATION OUTPUTS. PARTICIPANTS' EXPERIENCES SHAPED PERCEPTIONS OF A NATIONAL SUBSTANCE USE EWS, WITH SOME VOICING POTENTIAL OPPORTUNITIES AND OTHERS EXPRESSING DOUBTS ABOUT ITS EFFECTIVENESS.CONCLUSIONTHIS STUDY HIGHLIGHTS INTERCONNECTED SOCIAL, TECHNICAL, AND EXTERNAL ENVIRONMENTAL CONSIDERATIONS FOR THE DESIGN AND IMPLEMENTATION OF A NATIONAL SUBSTANCE USE EWS IN CANADA. IT ALSO DEMONSTRATES THE VALUE OF USING THE SOCIO-TECHNICAL SYSTEMS FRAMEWORK TO UNDERSTAND A COMPLEX PUBLIC HEALTH SURVEILLANCE ISSUE AND HOW IT CAN BE USED TO INFORM A PATH FORWARD. OBJECTIFSCETTE ETUDE VISAIT A APPLIQUER UNE APPROCHE DE PENSEE SYSTEMIQUE POUR EXPLORER LES FACTEURS INFLUENCANT LA DETECTION DES TENDANCES EMERGENTES EN MATIERE DE DROGUES DANS LES PROVINCES ET TERRITOIRES (P/T) DU CANADA AFIN DE MIEUX COMPRENDRE COMMENT LE CONTEXTE LOCAL PEUT INFLUENCER LA CONCEPTION ET LE RENDEMENT D'UN SYSTEME PANCANADIEN (C.-A-D. NATIONAL) D'ALERTE PRECOCE (SAP) EN MATIERE DE CONSOMMATION DE SUBSTANCES. CETTE ETUDE PRESENTE EGALEMENT UN ENSEMBLE DE RECOMMANDATIONS REALISABLES DECOULANT DES RESULTATS.METHODOLOGIE ET METHODESDES ENTREVUES SEMI-STRUCTUREES ONT ETE MENEES AUPRES DE 13 MEDECINS HYGIENISTES ET EPIDEMIOLOGISTES RECRUTES DANS TOUT LE CANADA ET TRAVAILLANT DANS LE DOMAINE DE LA TOXICOMANIE. L'ANALYSE DES RESEAUX THEMATIQUES ET SOCIAUX GUIDEE PAR LE CADRE DES SYSTEMES SOCIO-TECHNIQUES (STS) A ENSUITE ETE UTILISEE.RESULTATSLES OBSTACLES ET LES FACILITATEURS A LA DETECTION DES TENDANCES EMERGENTES EN MATIERE DE DROGUES DANS LES PROVINCES ET LES TERRITOIRES SONT LE PRODUIT DES LIENS ET DES INTERACTIONS COLLECTIFS ENTRE LES FACTEURS SOCIAUX (OBJECTIFS, PERSONNES, CULTURE), TECHNIQUES (OUTILS, PRATIQUES, INFRASTRUCTURE) ET ENVIRONNEMENTAUX EXTERNES (CADRES FINANCIERS, REGLEMENTAIRES, INTERVENANTS). LES LACUNES DANS PLUSIEURS DE CES DOMAINES ONT FACONNE LE COMPORTEMENT DU SYSTEME ET, ENSEMBLE, ONT CONTRIBUE A DES OPERATIONS FRAGMENTEES QUI MANQUAIENT D'ORIENTATION STRATEGIQUE, A DES PARTENARIATS INTERSECTORIELS MAL CONCUS ET A DE L'INFORMATION INEXPLOITABLE. LES EXPERIENCES DES PARTICIPANTS ONT FACONNE LES PERCEPTIONS D'UN SAP NATIONAL SUR LA CONSOMMATION DE SUBSTANCES, CERTAINS EXPRIMANT DES OPPORTUNITES POTENTIELLES ET D'AUTRES EXPRIMANT DES DOUTES QUANT A SON EFFICACITE.CONCLUSIONCETTE ETUDE MET EN EVIDENCE LES CONSIDERATIONS SOCIALES, TECHNIQUES ET ENVIRONNEMENTALES EXTERNES INTERCONNECTEES POUR LA CONCEPTION ET LA MISE EN OE UVRE D'UN SAP NATIONAL SUR LA CONSOMMATION DE SUBSTANCES AU CANADA. IL DEMONTRE EGALEMENT LA VALEUR DE L'UTILISATION DU CADRE STS POUR COMPRENDRE UN PROBLEME COMPLEXE DE SURVEILLANCE DE LA SANTE PUBLIQUE ET COMMENT IL PEUT ETRE UTILISE POUR ECLAIRER UNE VOIE A SUIVRE.","10.17269/s41997-023-00842-w","0008-4263","CANADIAN JOURNAL OF PUBLIC HEALTH-REVUE CANADIENNE DE SANTE PUBLIQUE",NA,"EXPLORING CHALLENGES AND OPPORTUNITIES IN DETECTING EMERGING DRUG TRENDS A SOCIOTECHNICAL ANALYSIS OF THE CANADIAN CONTEXT",NA,2023,"ISI","Can. J. Public Health-Rev. Can. Sante Publique",0,"none",NA,NA,"BOUCHOUAR E, 2023, Can. J. Public Health-Rev. Can. Sante Publique","BOUCHOUAR E, 2023, Can. J. Public Health-Rev. Can. Sante Publique"
"DEFOSSET AR, 2020, J. Public Health Manag. Pract.","DEFOSSET A;MOSST J;GASE T",NA,"10.1097/PHH.0000000000000958","1078-4659","JOURNAL OF PUBLIC HEALTH MANAGEMENT AND PRACTICE","270-279","THE LOS ANGELES DIABETES PREVENTION COALITION EXPERIENCE PRACTICAL APPLICATIONS OF SOCIAL NETWORK ANALYSIS TO INFORM COALITION BUILDING IN CHRONIC DISEASE PREVENTION","26",2020,"ISI","J. Public Health Manag. Pract.",0,"none",NA,NA,"DEFOSSET AR, 2020, J. Public Health Manag. Pract.","DEFOSSET AR, 2020, J. Public Health Manag. Pract."
"YUM S, 2022, DISASTER MED PUBLIC HEALTH PREP","YUM S","IN OUR INFORMATION TECHNOLOGY (IT) BASED SOCIETIES, SOCIAL MEDIA PLAYS AN IMPORTANT ROLE IN COMMUNICATIONS AND SOCIAL NETWORKS FOR COVID-19. THIS STUDY EXPLORES SOCIAL RESPONSES FOR COVID-19 IN NORTH AMERICA, WHICH IS THE MOST SEVERE CONTINENT AFFECTED BY THE COVID-19 PANDEMIC. THIS STUDY EMPLOYS SOCIAL NETWORK ANALYSIS FOR TWITTER AMONG THE US, CANADA, AND MEXICO. THIS STUDY FINDS THAT THE 3 COUNTRIES SHOW DIFFERENT CHARACTERISTICS OF SOCIAL NETWORKS FOR COVID-19. FOR EXAMPLE, THE PRIME MINISTER PLAYS THE SECOND MOST IMPORTANT ROLE IN THE CANADIAN NETWORKS, WHEREAS THE PRESIDENTS PLAY THE MOST SIGNIFICANT ROLE IN THEM, IN THE US, AND MEXICO. WHO SHOWS A PIVOTAL EFFECT ON SOCIAL NETWORKS OF COVID-19 IN CANADA AND THE US, WHEREAS IT DOES NOT AFFECT THEM IN MEXICO. CANADIANS ARE INTERESTED IN COVID-19 APPS, THE AMERICAN PEOPLE CRITICIZE THE PRESIDENT AND ADMINISTRATION AS INCOMPETENT IN TERMS OF COVID-19, AND THE MEXICAN PEOPLE SEARCH FOR COVID-19 CASES AND THE PANDEMIC IN MEXICO. THIS STUDY SHOWS THAT GOVERNMENTS AND DISEASE EXPERTS SHOULD UNDERSTAND SOCIAL NETWORKS AND COMMUNICATIONS OF SOCIAL NETWORK SERVICES, TO DEVELOP EFFECTIVE COVID-19 POLICIES ACCORDING TO THE CHARACTERISTICS OF THEIR COUNTRY.","10.1017/DMP.2022.290","1938-744X (ELECTRONIC) 1935-7893 (LINKING)","DISASTER MEDICINE AND PUBLIC HEALTH PREPAREDNESS","E320","THE COVID19 RESPONSE IN NORTH AMERICA","17",2022,"ISI","DISASTER MED PUBLIC HEALTH PREP",0,"none","DESIGN, CONSTRUCTION, AND PLANNING, UNIVERSITY OF FLORIDA, GAINESVILLE, FL, USA.;","UNIVERSITY OF FLORIDA","YUM S, 2022, DISASTER MED PUBLIC HEALTH PREP","YUM S, 2022, DISASTER MED PUBLIC HEALTH PREP"
"YBARRA M, 2021, CHILD OBES","YBARRA M;BARNETT T;YU J;VAN H A;DROUIN O;KAKINAMI L;SAINT-CHARLES J;HENDERSON M","BACKGROUND AND OBJECTIVE: WEIGHT-RELATED BEHAVIORS ARE DETERMINED BY MULTIPLE INDIVIDUAL AND CONTEXTUAL FACTORS, WITH RECENT EVIDENCE IMPLICATING PERSONAL SOCIAL NETWORKS (PSNS). GREATER UNDERSTANDING OF THESE RELATIONSHIPS COULD HELP INFORM HEALTHY WEIGHT PROMOTING INTERVENTIONS. WE CONDUCTED A FEASIBILITY STUDY AMONG YOUTH AT RISK OF OBESITY TO DOCUMENT PROCESS OUTCOMES, TO DISCERN RELATIONSHIPS BETWEEN PSN FEATURES AND WEIGHT-RELATED BEHAVIORS, AND TO GENERATE HYPOTHESES WITH RESPECT TO PERCEIVED SOCIAL SUPPORT (SS) AND SEX. METHODS: PARTICIPANTS (EGOS) NOMINATED UP TO 10 PEOPLE (ALTERS) WITH WHOM THEY DISCUSSED IMPORTANT MATTERS. EGOS REPORTED THEIR OWN AND EACH ALTER'S AGE, SEX, BODY SHAPE, LIFESTYLE BEHAVIORS, RELATION, FREQUENCY OF EXERCISING WITH EACH ALTER, AND OF BEING ENCOURAGED BY EACH ALTER TO EXERCISE. WE EXAMINED RELATIONSHIPS BETWEEN PSN FEATURES AND WEIGHT-RELATED OUTCOMES AND EXPLORED THE ROLE OF SS, USING BOTH CORRELATIONAL AND LINEAR REGRESSION ANALYSES. RESULTS: THERE WERE 45 PARTICIPANTS (MEAN AGE 16.4 YEARS) AND BODY MASS INDEX Z-SCORE (ZBMI) RANGED FROM -1.2 TO 3.9. THERE WERE FEW MISSING RESPONSES TO PSN ITEMS; BROAD VARIATION ACROSS MOST ITEMS, INCLUDING SS SCORES, WAS REPORTED. CORRELATIONS POINTED TO PLAUSIBLE RELATIONSHIPS IMPLICATING PSN FEATURES AND LIFESTYLE BEHAVIORS. IN EXPLORATORY ANALYSES, NETWORK-BASED SS WAS POSITIVELY ASSOCIATED WITH ADIPOSITY IN GIRLS AND NEGATIVELY ASSOCIATED IN BOYS, WHILE LIFESTYLE ROLE MODELLING WAS NOT ASSOCIATED WITH ADIPOSITY. CONCLUSIONS: OUR FINDINGS SUPPORT THE FEASIBILITY OF MEASURING THE PSN IN YOUTH AND THE POTENTIAL FOR USING SOCIAL NETWORK ANALYSIS TO INVESTIGATE SOCIAL AND BEHAVIORAL MECHANISMS ASSOCIATED WITH OBESITY.","10.1089/CHI.2020.0343","2153-2176 (ELECTRONIC) 2153-2168 (LINKING)","CHILDHOOD OBESITY (PRINT)","542-550","PERSONAL SOCIAL NETWORKS AND ADIPOSITY IN ADOLESCENTS A FEASIBILITY STUDY","17",2021,"ISI","CHILD OBES",0,"none","RESEARCH CENTER OF SAINTE JUSTINE UNIVERSITY HOSPITAL, UNIVERSIT DE MONTRAL, MONTRAL, QUBEC, CANADA.; RESEARCH CENTER OF SAINTE JUSTINE UNIVERSITY HOSPITAL, UNIVERSIT DE MONTRAL, MONTRAL, QUBEC, CANADA.; DEPARTMENT OF FAMILY MEDICINE, MCGILL UNIVERSITY, MONTRAL, QUBEC, CANADA.; EPIDEMIOLOGY AND BIOSTATISTICS UNIT, CENTER ARMAND-FRAPPIER SANT BIOTECHNOLOGIE, INSTITUT NATIONAL DE LA RECHERCHE SCIENTIFIQUE, UNIVERSIT DU QUBEC, LAVAL, QUBEC, CANADA.; INGRAM SCHOOL OF NURSING, MCGILL UNIVERSITY, MONTREAL, QUBEC, CANADA.; RESEARCH CENTER OF SAINTE JUSTINE UNIVERSITY HOSPITAL, UNIVERSIT DE MONTRAL, MONTRAL, QUBEC, CANADA.; DEPARTMENT OF PEDIATRICS, FACULTY OF MEDICINE, UNIVERSIT DE MONTRAL, MONTRAL, QUBEC, CANADA.; DEPARTMENT OF MATHEMATICS AND STATISTICS, CONCORDIA UNIVERSITY, MONTREAL, QUBEC, CANADA.; INSTITUT SANT ET SOCIT, UNIVERSIT DU QUBEC  MONTRAL, MONTRAL, QUBEC, CANADA.; RESEARCH CENTER OF SAINTE JUSTINE UNIVERSITY HOSPITAL, UNIVERSIT DE MONTRAL, MONTRAL, QUBEC, CANADA.; DEPARTMENT OF PEDIATRICS, FACULTY OF MEDICINE, UNIVERSIT DE MONTRAL, MONTRAL, QUBEC, CANADA.; DEPARTMENT OF SOCIAL AND PREVENTIVE MEDICINE, SCHOOL OF PUBLIC HEALTH, UNIVERSIT DE MONTRAL, MONTRAL, QUBEC, CANADA.;","RESEARCH CENTER OF SAINTE JUSTINE UNIVERSITY HOSPITAL;RESEARCH CENTER OF SAINTE JUSTINE UNIVERSITY HOSPITAL;MCGILL UNIVERSITY;UNIVERSIT DU QUBEC;MCGILL UNIVERSITY;RESEARCH CENTER OF SAINTE JUSTINE UNIVERSITY HOSPITAL;UNIVERSIT DE MONTRAL;CONCORDIA UNIVERSITY;UNIVERSIT DU QUBEC  MONTRAL;RESEARCH CENTER OF SAINTE JUSTINE UNIVERSITY HOSPITAL;UNIVERSIT DE MONTRAL;UNIVERSIT DE MONTRAL","YBARRA M, 2021, CHILD OBES","YBARRA M, 2021, CHILD OBES"
"ZACHRISON KS, 2019, CIRC CARDIOVASC QUAL OUTCOMES","ZACHRISON K;DHAND A;SCHWAMM L;ONNELA J","THE LANDSCAPE OF STROKE SYSTEMS OF CARE IS EVOLVING AS PATIENTS ARE INCREASINGLY TRANSFERRED BETWEEN HOSPITALS FOR ACCESS TO HIGHER LEVELS OF CARE. THIS IS DRIVEN BY TIME-SENSITIVE DISABILITY-REDUCING INTERVENTIONS SUCH AS MECHANICAL THROMBECTOMY. HOWEVER, COORDINATION AND TRIAGE OF PATIENTS FOR SUCH TREATMENT REMAIN A CHALLENGE WORLDWIDE, PARTICULARLY GIVEN COMPLEX ELIGIBILITY CRITERIA AND VARYING TIME WINDOWS FOR TREATMENT. NETWORK ANALYSIS IS AN APPROACH THAT MAY BE APPLIED TO THIS PROBLEM. HOSPITAL NETWORKS INTERLINKED BY PATIENTS MOVED FROM FACILITY TO FACILITY CAN BE STUDIED USING NETWORK MODELING THAT RESPECTS THE INTERDEPENDENT NATURE OF THE SYSTEM. THIS ALLOWS UNDERSTANDING OF THE CENTRAL HUBS, THE CHANGE OF NETWORK STRUCTURE OVER TIME, AND THE DIFFUSION OF INNOVATIONS. THIS TOPICAL REVIEW INTRODUCES THE BASIC PRINCIPLES OF NETWORK SCIENCE AND PROVIDES AN OVERVIEW ON THE APPLICATIONS AND POTENTIAL INTERVENTIONS IN STROKE SYSTEMS OF CARE.","10.1161/CIRCOUTCOMES.119.005526","1941-7705 (ELECTRONIC) 1941-7713 (PRINT) 1941-7713 (LINKING)","CIRCULATION. CARDIOVASCULAR QUALITY AND OUTCOMES","E005526","A NETWORK APPROACH TO STROKE SYSTEMS OF CARE","12",2019,"ISI","CIRC CARDIOVASC QUAL OUTCOMES",0,"none","DEPARTMENT OF EMERGENCY MEDICINE (K.;S.;Z.;), MASSACHUSETTS GENERAL HOSPITAL, BOSTON.; DEPARTMENT OF NEUROLOGY, BRIGHAM AND WOMEN'S HOSPITAL, BOSTON, MA (A.;D.;).; DEPARTMENT OF NEUROLOGY (L.;H.;S.;), MASSACHUSETTS GENERAL HOSPITAL, BOSTON.; DEPARTMENT OF BIOSTATISTICS, HARVARD T.;H.; CHAN SCHOOL OF PUBLIC HEALTH, BOSTON, MA (J.;-P.;O.;).;","MASSACHUSETTS GENERAL HOSPITAL;BRIGHAM AND WOMEN'S HOSPITAL;MASSACHUSETTS GENERAL HOSPITAL;CHAN SCHOOL OF PUBLIC HEALTH","ZACHRISON KS, 2019, CIRC CARDIOVASC QUAL OUTCOMES","ZACHRISON KS, 2019, CIRC CARDIOVASC QUAL OUTCOMES"
"NJERU JW, 2020, BMC PUBLIC HEALTH","NJERU J;WIELAND M;OKAMOTO J;NOVOTNY P;BREEN-LYLES M;OSMAN A;AHMED Y;NUR M;NUR O;SIA I","BACKGROUND: SOMALI IMMIGRANTS AND REFUGEES TO THE UNITED STATES ARE AT HIGH RISK FOR OBESITY AND RELATED CARDIOVASCULAR RISK. SOCIAL NETWORK FACTORS INFLUENCE HEALTH BEHAVIORS AND ARE IMPORTANT CONTRIBUTORS TO THE OBESITY EPIDEMIC. THE OBJECTIVE OF THIS STUDY WAS TO DESCRIBE SOCIAL NETWORKS AND OBESITY-RELATED CHARACTERISTICS AMONG ADULT SOMALI IMMIGRANTS IN A MINNESOTA CITY IN ORDER TO INFORM A COMMUNITY-BASED, PARTICIPATORY, RESEARCH-DERIVED, SOCIAL NETWORK INTERVENTION TO DECREASE OBESITY RATES. METHODS: SURVEY DATA (DEMOGRAPHICS, GENERAL HEALTH MEASURES, AND SOCIOBEHAVIORAL AND NETWORK MEASURES) AND HEIGHT AND WEIGHT MEASURES (FOR CALCULATING BODY MASS INDEX) WERE COLLECTED FROM ADULT SOMALI IMMIGRANTS BY BILINGUAL STUDY TEAM MEMBERS AT COMMUNITY LOCATIONS. DESCRIPTIVE STATISTICS WERE USED TO REPORT THE SURVEY AND BIOMETRIC DATA. LOGISTIC REGRESSION MODELS WERE USED TO DESCRIBE THE BASIC ASSOCIATIONS OF PARTICIPANTS AND NETWORK FACTORS. NETWORK DATA WERE ANALYZED TO IDENTIFY NODES AND TIES, TO VISUALIZE THE NETWORK, AND TO IDENTIFY POTENTIAL INTERVENTIONISTS FOR A FUTURE SOCIAL NETWORK INTERVENTION. RESULTS: OF THE 646 PARTICIPANTS, 50% WERE OVERWEIGHT OR AFFECTED BY OBESITY. THE NETWORK HAD 1703 NODES WITH 3583 TIES BETWEEN NODES, AND MODULARITY WAS HIGH (0.75). COMPARED WITH RESPONDENTS OF NORMAL WEIGHT, PARTICIPANTS WHO WERE OVERWEIGHT OR AFFECTED BY OBESITY HAD MORE NETWORK MEMBERS WHO WERE ALSO OVERWEIGHT OR OBESE (ODDS RATIO [OR], 2.90; 95% CI, 1.11-7.56; P = .03); THIS WAS MOST NOTABLE FOR MEN (OR, 4.58; 95% CI, 1.22-17.22; P = .02) AND SUGGESTIVE FOR THOSE 50 YEARS OR OLDER (OR, 24.23; 95% CI, 1.55-377.83; P = .03). WEIGHT LOSS INTENTION AMONG PARTICIPANTS WHO WERE OVERWEIGHT OR AFFECTED BY OBESITY WAS ASSOCIATED WITH NUMBER OF FAMILY MEMBERS AND FRIENDS TRYING TO LOSE WEIGHT, ENABLING FUNCTIONAL NETWORK FACTORS (SOCIAL NORMS FOR WEIGHT LOSS, SOCIAL SUPPORT FOR HEALTHY EATING, AND SOCIAL COHESION), AND LESS FAVORABLE OBESOGENIC SOCIAL NORMS. CONCLUSIONS: IN THIS COMMUNITY SAMPLE OF SOMALI IMMIGRANTS, DISTINCT SOCIAL NETWORKS ARE CLUSTERED BY WEIGHT STATUS, AND SOCIAL CONTACTS AND FUNCTIONAL NETWORK CHARACTERISTICS ARE RELATED TO INDIVIDUALS' WEIGHT LOSS INTENTIONS. THESE FACTORS SHOULD BE CONSIDERED IN WEIGHT LOSS INTERVENTIONS AND PROGRAMS. A SOCIAL NETWORK INTERVENTION TARGETING WEIGHT LOSS, WITHIN A COMMUNITY-BASED PARTICIPATORY RESEARCH FRAMEWORK, IS FEASIBLE IN THIS VULNERABLE POPULATION.","10.1186/S12889-020-8315-7","1471-2458 (ELECTRONIC) 1471-2458 (LINKING)","BMC PUBLIC HEALTH","238","SOCIAL NETWORKS AND OBESITY AMONG SOMALI IMMIGRANTS AND REFUGEES","20",2020,"ISI","BMC PUBLIC HEALTH",0,"none","DEPARTMENT OF MEDICINE, MAYO CLINIC, ROCHESTER, MN, USA.; NJERU.;JANE@MAYO.;EDU.; DEPARTMENT OF MEDICINE, MAYO CLINIC, ROCHESTER, MN, USA.; RESEARCH LABORATORIES, MAYO CLINIC, SCOTTSDALE, AZ, USA.; DIVISION OF BIOMEDICAL STATISTICS AND INFORMATICS, MAYO CLINIC, ROCHESTER, MN, USA.; GASTROENTEROLOGY RESEARCH UNIT, MAYO CLINIC, ROCHESTER, MN, USA.; SOMALI COMMUNITY RESETTLEMENT SERVICES, ROCHESTER, MN, USA.; DEPARTMENT OF MEDICINE, MAYO CLINIC, ROCHESTER, MN, USA.; DEPARTMENT OF MEDICINE, MAYO CLINIC, ROCHESTER, MN, USA.; SOMALIA REBUILD ORGANIZATION, ROCHESTER, MN, USA.; DEPARTMENT OF MEDICINE, MAYO CLINIC, ROCHESTER, MN, USA.;","MAYO CLINIC;MAYO CLINIC;RESEARCH LABORATORIES;MAYO CLINIC;GASTROENTEROLOGY RESEARCH UNIT;SOMALI COMMUNITY RESETTLEMENT SERVICES;MAYO CLINIC;MAYO CLINIC;MAYO CLINIC","NJERU JW, 2020, BMC PUBLIC HEALTH","NJERU JW, 2020, BMC PUBLIC HEALTH"
