"","AU","AB","DI","SN","SO","PP","TI","VL","PY","DB","J9","TC","CR","C1","AU_UN","SR_FULL","SR"
"HU F, 2023, Front. Public Health","HU F;QIU L;XIANG Y;WEI S;SUN H;HU H;WENG X;MAO L;ZENG M","INTRODUCTIONTHE NATURAL DISASTERS AND CLIMATE ANOMALIES CAUSED BY INCREASING GLOBAL CARBON EMISSIONS HAVE SERIOUSLY THREATENED PUBLIC HEALTH. TO SOLVE INCREASINGLY SERIOUS ENVIRONMENTAL POLLUTION PROBLEMS, THE CHINESE GOVERNMENT HAS COMMITTED ITSELF TO ACHIEVING THE GOALS OF PEAK CARBON EMISSIONS AND CARBON NEUTRALITY. THE LOW-CARBON PATENT APPLICATION IS AN IMPORTANT MEANS TO ACHIEVE THESE GOALS AND PROMOTE PUBLIC HEALTH. METHODSTHIS STUDY ANALYZES THE BASIC SITUATION, SPATIAL NETWORK, AND INFLUENCING FACTORS OF LOW-CARBON PATENT APPLICATIONS IN CHINA SINCE 2001 AT THE PROVINCIAL AND URBAN AGGLOMERATION LEVELS USING SOCIAL NETWORK ANALYSIS BASED ON DATA FROM THE INCOPAT GLOBAL PATENT DATABASE. RESULTSTHE FOLLOWING FINDINGS ARE ESTABLISHED. (1) FROM THE NUMBER OF LOW-CARBON PATENT APPLICATIONS, THE TOTAL NUMBER OF LOW-CARBON PATENT APPLICATIONS IN CHINA INCREASED YEAR BY YEAR, WHILE THE NUMBER OF APPLICATIONS IN THE EASTERN REGION WAS LARGER THAN THOSE IN THE CENTRAL AND WESTERN REGIONS, BUT SUCH REGIONAL DIFFERENCES HAD BEEN DECREASING. (2) AT THE INTERPROVINCIAL LEVEL, LOW-CARBON PATENT APPLICATIONS SHOWED A COMPLEX AND MULTITHREADED NETWORK STRUCTURE. IN PARTICULAR, THE EASTERN COASTAL PROVINCES OCCUPIED THE CORE POSITION IN THE NETWORK. THE WEIGHTED DEGREE DISTRIBUTION OF CHINA'S INTERPROVINCIAL LOW-CARBON PATENT COOPERATION NETWORK IS AFFECTED BY VARIOUS FACTORS, INCLUDING ECONOMIC DEVELOPMENT, FINANCIAL SUPPORT, LOCAL SCIENTIFIC RESEARCH LEVEL, AND LOW-CARBON AWARENESS. (3) AT THE URBAN AGGLOMERATION LEVEL, THE EASTERN COASTAL URBAN AGGLOMERATIONS SHOWED A RADIAL STRUCTURE WITH THE CENTRAL CITY AS THE CORE. URBAN INNOVATION CAPABILITY, ECONOMIC DEVELOPMENT, LOW-CARBON DEVELOPMENT AWARENESS, LEVEL OF TECHNOLOGY IMPORT FROM OVERSEAS, AND INFORMATIZATION LEVEL ARE HIGHLY CORRELATED WITH THE WEIGHTED DEGREE OF LOW-CARBON COOPERATION NETWORKS OF URBAN AGGLOMERATIONS. DISCUSSIONTHIS STUDY PROVIDES IDEAS FOR THE CONSTRUCTION AND GOVERNANCE OF LOW-CARBON TECHNOLOGY INNOVATION SYSTEM AND PERSPECTIVES FOR THEORETICAL RESEARCH ON PUBLIC HEALTH AND HIGH-QUALITY DEVELOPMENT IN CHINA.","10.3389/fpubh.2023.1121860",NA,"FRONTIERS IN PUBLIC HEALTH",NA,"SPATIAL NETWORK AND DRIVING FACTORS OF LOWCARBON PATENT APPLICATIONS IN CHINA FROM A PUBLIC HEALTH PERSPECTIVE","11",2023,"ISI","Front. Public Health",0,"none",NA,NA,"HU F, 2023, Front. Public Health","HU F, 2023, Front. Public Health"
"TRACY M, 2023, J. Fam. Violence","TRACY M;CHONG L;STRULLY K;GORDIS E;CERDA M;MARSHALL B","PURPOSEWE AIMED TO SYNTHESIZE INSIGHTS FROM SYSTEMS SCIENCE APPROACHES APPLIED TO DOMESTIC AND GENDER-BASED VIOLENCE.METHODSWE CONDUCTED A SYSTEMATIC REVIEW OF SYSTEMS SCIENCE STUDIES (SYSTEMS THINKING, GROUP MODEL-BUILDING, AGENT-BASED MODELING [ABM], SYSTEM DYNAMICS [SD] MODELING, SOCIAL NETWORK ANALYSIS [SNA], AND NETWORK ANALYSIS [NA]) APPLIED TO DOMESTIC OR GENDER-BASED VIOLENCE, INCLUDING VICTIMIZATION, PERPETRATION, PREVENTION, AND COMMUNITY RESPONSES. WE USED BLINDED REVIEW TO IDENTIFY PAPERS MEETING OUR INCLUSION CRITERIA (I.E., PEER-REVIEWED JOURNAL ARTICLE OR PUBLISHED BOOK CHAPTER THAT DESCRIBED A SYSTEMS SCIENCE APPROACH TO DOMESTIC OR GENDER-BASED VIOLENCE, BROADLY DEFINED) AND ASSESSED THE QUALITY AND TRANSPARENCY OF EACH STUDY.RESULTSOUR SEARCH YIELDED 1,841 STUDIES, AND 74 STUDIES MET OUR INCLUSION CRITERIA (45 SNA, 12 NA, 8 ABM, AND 3 SD). ALTHOUGH RESEARCH AIMS VARIED ACROSS STUDY TYPES, THE INCLUDED STUDIES HIGHLIGHTED SOCIAL NETWORK INFLUENCES ON RISKS FOR DOMESTIC VIOLENCE, CLUSTERING OF RISK FACTORS AND VIOLENCE EXPERIENCES, AND POTENTIAL TARGETS FOR INTERVENTION. WE ASSESSED THE QUALITY OF THE INCLUDED STUDIES AS MODERATE, THOUGH ONLY A MINORITY ADHERED TO BEST PRACTICES IN MODEL DEVELOPMENT AND DISSEMINATION, INCLUDING STAKEHOLDER ENGAGEMENT AND SHARING OF MODEL CODE.CONCLUSIONSSYSTEMS SCIENCE APPROACHES FOR THE STUDY OF DOMESTIC AND GENDER-BASED VIOLENCE HAVE SHED LIGHT ON THE COMPLEX PROCESSES THAT CHARACTERIZE DOMESTIC VIOLENCE AND ITS BROADER CONTEXT. FUTURE RESEARCH IN THIS AREA SHOULD INCLUDE GREATER DIALOGUE BETWEEN DIFFERENT TYPES OF SYSTEMS SCIENCE APPROACHES, CONSIDERATION OF PEER AND FAMILY INFLUENCES IN THE SAME MODELS, AND EXPANDED USE OF BEST PRACTICES, INCLUDING CONTINUED ENGAGEMENT OF COMMUNITY STAKEHOLDERS.","10.1007/s10896-023-00578-8","0885-7482","JOURNAL OF FAMILY VIOLENCE","1225-1241","A SYSTEMATIC REVIEW OF SYSTEMS SCIENCE APPROACHES TO UNDERSTAND AND ADDRESS DOMESTIC AND GENDERBASED VIOLENCE","38",2023,"ISI","J. Fam. Violence",0,"none",NA,NA,"TRACY M, 2023, J. Fam. Violence","TRACY M, 2023, J. Fam. Violence"
"ZHU Y, 2020, Inf. Res.-AN Int. Electron. J.","ZHU Y;ZHANG J","INTRODUCTION. A SUBJECT DIRECTORY PLAYS AN IMPORTANT ROLE IN A WEB PORTAL AND IT HELPS USERS EFFECTIVELY NAVIGATE THE PORTAL. THIS STUDY EXAMINES A SUBJECT DIRECTORY SYSTEM RELATED TO MENTAL HEALTH IN THE MEDLINEPLUS PORTAL AND PROVIDES SUGGESTIONS OF OPTIMISATION TO ENHANCE THE SUBJECT DIRECTORY SYSTEM. METHOD. A MIXED RESEARCH METHOD COMBINING SOCIAL NETWORK ANALYSIS AND INFERENTIAL STATISTICS WAS APPLIED. ANALYSIS. A STRUCTURAL AND A SEMANTIC SOCIAL NETWORK WERE BUILT REGARDING THE SELECTED HEALTH TOPICS RELATED TO MENTAL HEALTH IN THE MEDLINEPLUS PORTAL. THE TWO NETWORKS WERE COMPARED AND THE OUTCOMES WERE EVALUATED BY DOMAIN EXPERTS. RESULTS. AMONG THE NINETY-NINE COLLECTED HEALTH TOPICS RELATED TO MENTAL HEALTH, THREE THEMES WERE IDENTIFIED THROUGH THE VISUALISATION ANALYSIS REGARDING GROUPED HEALTH TOPICS. PATTERNS AND CHARACTERISTICS OF EACH THEME GROUP WERE DISCUSSED. AS A RESULT, FIFTY-FIVE BIDIRECTIONAL AND TWENTY-THREE UNIDIRECTIONAL EDGES WERE IDENTIFIED AND RECOMMENDED TO BE ADDED TO THE CORRESPONDING HEALTH TOPIC PAGES. THE RECOMMENDED RESULTS INDICATE THAT THE SUBJECT DIRECTORY OF SPECIFIC MENTAL HEALTH RELATED TOPICS IS WELL CONSTRUCTED, WHILE HEALTH CONSUMER GROUPS RELATED TOPICS MIGHT NEED MORE IMPROVEMENTS. THE OPTIMISED SUBJECT DIRECTORY HAS SIGNIFICANTLY STRONGER SEMANTIC CONNECTION, AND THE RESULTS OF THE RECOMMENDATIONS ARE CONSISTENT WITH THE EVALUATION OUTCOME OF TWO DOMAIN EXPERTS. CONCLUSIONS. THE FINDINGS OF THIS STUDY CAN PROVIDE IDEAS OF OPTIMISING AND ENHANCING THE SUBJECT DIRECTORY SYSTEM TO THE PUBLIC HEALTH PORTAL CREATORS AND HEALTH PROFESSIONALS, AND BENEFIT HEALTH CONSUMERS FOR SEEKING HEALTH INFORMATION ONLINE. THE METHODOLOGIES APPLIED IN THIS STUDY MAY PROVIDE A NOVEL WAY TO INVESTIGATE AND ENHANCE SUBJECT DIRECTORIES IN GENERAL.","10.47989/irpaper876","1368-1613","INFORMATION RESEARCH-AN INTERNATIONAL ELECTRONIC JOURNAL",NA,"SOCIAL NETWORK ANALYSIS OF THE MENTAL HEALTH SUBTOPIC ON THE MEDLINEPLUS SUBJECT DIRECTORY","25",2020,"ISI","Inf. Res.-AN Int. Electron. J.",0,"none",NA,NA,"ZHU Y, 2020, Inf. Res.-AN Int. Electron. J.","ZHU Y, 2020, Inf. Res.-AN Int. Electron. J."
"FRANCO-TRIGO L, 2020, Res. Soc. \& Adm. Pharm.","FRANCO-TRIGO L;MARQUES-SANCHEZ P;TUDBALL J;BENRIMOJ S;MARTINEZ-MARTINEZ F;SABATER-HERNANDEZ D","BACKGROUND: STAKEHOLDER PARTICIPATION OPTIMIZES HEALTH PLANNING, FOSTERING THE ACCEPTABILITY AND INTEGRATION OF NEW HEALTH SERVICES. COLLABORATIVE APPROACHES MAY HELP OVERCOME EXISTING CHALLENGES IN THE DEVELOPMENT, IMPLEMENTATION AND EVALUATION OF COMMUNITY PHARMACY SERVICES (CPSS). STAKEHOLDER ANALYSES LAY THE FOUNDATION FOR BUILDING COLLABORATION IN THE INTEGRATED DELIVERY OF HEALTH CARE. OBJECTIVES: THIS STAKEHOLDER ANALYSIS WAS PERFORMED TO ORGANIZE A COLLABORATIVE INITIATIVE TO DEVELOP A CPS AIMED AT PREVENTING CARDIOVASCULAR DISEASES IN ANDALUCIA (SPAIN). IT AIMED TO IDENTIFY STAKEHOLDERS, DIFFERENTIATE/CATEGORIZE THEM, AND ANALYZE STAKEHOLDER RELATIONSHIPS. METHOD: STAKEHOLDERS WERE IDENTIFIED USING THE SNOWBALLING TECHNIQUE. TO DIFFERENTIATE/CATEGORIZE STAKEHOLDERS AND ANALYZE THE RELATIONSHIPS (I.E., COLLABORATION) AN ONLINE WEB-BASED QUESTIONNAIRE WAS SENT TO 186 STAKEHOLDERS. STAKEHOLDERS WERE ASKED FOR: (1) THEIR INFLUENCE, INTEREST AND ATTITUDE TOWARD THE INITIATIVE; (2) STAKES/INTERESTS; (3) CAPACITY TO CONTRIBUTE TO THE INITIATIVE; (4) DESIRE FOR INVOLVEMENT; (5) CONCERNS; (6) WHOM THEY CONSIDERED A KEY STAKEHOLDER; AND (7) THE LEVEL OF COLLABORATION THEY HAD WITH OTHER STAKEHOLDERS. DATA ANALYSIS COMBINED DESCRIPTIVE QUALITATIVE CONTENT ANALYSIS, DESCRIPTIVE QUANTITATIVE ANALYSIS AND SOCIAL NETWORK ANALYSIS. RESULTS: OF THE 186 STAKEHOLDERS APPROACHED, 96 (51.6\%) PARTICIPATED. THE IDENTIFICATION PROCESS YIELDED 217 STAKEHOLDERS (INDIVIDUALS, ORGANIZATIONS OR COLLECTIVES), CLASSIFIED INTO 10 GROUPS. FIFTY-SEVEN STAKEHOLDERS WERE CONSIDERED CRITICAL TO THE INTENDED INITIATIVE. MOST PARTICIPANT STAKEHOLDERS SUPPORTED THE INITIATIVE AND WERE WILLING TO COLLABORATE IN THE DEVELOPMENT OF THE CPS. PUBLIC HEALTH AND SCIENCE WERE THE MAIN DRIVING INTERESTS. A COLLABORATION NETWORK EXISTED BETWEEN THE 96 STAKEHOLDERS. CONCLUSION: THIS STUDY REVEALED THE MAGNITUDE OF THE SOCIAL SYSTEM SURROUNDING THE DEVELOPMENT OF A CPS AIMED AT PREVENTING CARDIOVASCULAR DISEASE. A LARGE ARRAY OF STAKEHOLDERS WAS IDENTIFIED AND ANALYZED, AND A GROUP OF CRITICAL STAKEHOLDERS SELECTED. STAKEHOLDER CHARACTERISTICS SUCH AS ATTITUDE TOWARD THE INITIATIVE, POTENTIAL CONTRIBUTION, DESIRE FOR INVOLVEMENT, AND THE EXISTING COLLABORATION NETWORK, PROVIDED COMPLEMENTARY INFORMATION THAT WAS HELPFUL FOR PLANNING THE PROCESS AND STAKEHOLDER ENGAGEMENT.","10.1016/j.sapharm.2019.05.008","1551-7411","RESEARCH IN SOCIAL \& ADMINISTRATIVE PHARMACY","216-229","COLLABORATIVE HEALTH SERVICE PLANNING A STAKEHOLDER ANALYSIS WITH SOCIAL NETWORK ANALYSIS TO DEVELOP A COMMUNITY PHARMACY SERVICE","16",2020,"ISI","Res. Soc. \& Adm. Pharm.",0,"none",NA,NA,"FRANCO-TRIGO L, 2020, Res. Soc. \& Adm. Pharm.","FRANCO-TRIGO L, 2020, Res. Soc. \& Adm. Pharm."
"MOLDOVAN ID, 2019, Am. J. Infect. Control.","MOLDOVAN I;SUH K;LIU E;JOLLY A","BACKGROUND: DESPITE INCREASED AWARENESS OF INFECTION CONTROL PRECAUTIONS, METHICILLIN-RESISTANT STAPHYLOCOCCUS AUREUS (MRSA) STILL SPREADS THROUGH PATIENTS AND CONTAMINATED OBJECTS, CAUSING A SUBSTANTIAL BURDEN OF ILLNESS AND COST. OUR OBJECTIVE WAS TO DEFINE RISK FACTORS FOR CONTRACTING MRSA IN A TERTIARY HEALTH CARE FACILITY USING A HISTORIC CASE-CONTROL STUDY AND TO VALIDATE HEALTH CARE NETWORK CHANGES DURING PRE-OUTBREAK AND OUTBREAK PERIODS. METHODS: WE CONDUCTED A CASE-CONTROL STUDY USING SECONDARY DATA ON HOSPITALIZATIONS WHERE INFECTED OR COLONIZED CASES WERE COMPARED WITH MATCHED CONTROLS WHO TESTED NEGATIVE BY AGE, SEX, AND CAMPUS OVER 1 YEAR. SOCIAL NETWORKS OF ALL CASES AND CONTROLS WERE BUILT FROM LINKS JOINING PATIENTS TO ROOMS, ROOMMATES, AND HEALTH CARE PROVIDERS OVER TIME. RESULTS: MATCHED CONTROLS WERE SIMILAR TO CASES IN COMORBIDITY, LENGTHS OF STAY, MORTALITY, AND NUMBER OF ROOMMATES, ROOMS, AND HEALTH CARE PROVIDERS. AS EXPECTED, THE NUMBER OF ROOMS AND ROOMMATES INCREASED IN THE OUTBREAK BY MORE THAN 50\%. A TIMED ANIMATION OF THE NETWORK AT ONE CAMPUS IDENTIFIED POTENTIAL SOURCE PATIENTS LINKED TO 2 ROOMS AND MANY ROOMMATES, AFTER WHICH CASES CONNECTED TO THOSE SAME ROOMS PROLIFERATED. CONCLUSIONS: ONLY THE NETWORK ANIMATION OVER TIME REVEALED POSSIBLE TRANSMISSION OF MRSA THROUGH THE NETWORK, RATHER THAN ATTRIBUTES MEASURED IN THE TRADITIONAL CASE CONTROL STUDY. (C) 2019 ASSOCIATION FOR PROFESSIONALS IN INFECTION CONTROL AND EPIDEMIOLOGY, INC. PUBLISHED BY ELSEVIER INC. ALL RIGHTS RESERVED.","10.1016/j.ajic.2019.05.026","0196-6553","AMERICAN JOURNAL OF INFECTION CONTROL","1420-1425","NETWORK ANALYSIS OF CASES WITH METHICILLINRESISTANT ISTAPHYLOCOCCUS AUREUSI AND CONTROLS IN A LARGE TERTIARY CARE FACILITY","47",2019,"ISI","Am. J. Infect. Control.",0,"none",NA,NA,"MOLDOVAN ID, 2019, Am. J. Infect. Control.","MOLDOVAN ID, 2019, Am. J. Infect. Control."
"XIA Q, 2022, Sci. Public Policy","XIA Q;LIU L;LI X","DEVELOPING EMERGENCY DRUGS IN TIME IS KEY TO RESPONDING TO PUBLIC HEALTH EMERGENCIES SUCH AS THE CORONAVIRUS DISEASE 2019 (COVID-19) PANDEMIC. THIS RESEARCH CONSTRUCTS PATENT ASSIGNEE CITATION NETWORKS BASED ON COVID-19 DRUG PATENTS AND APPLIES TECHNOLOGY LIFE CYCLE ANALYSIS AND SOCIAL NETWORK ANALYSIS TO EXAMINE THESE NETWORKS. THE RESULTS REVEAL THE EVOLUTION AND STRUCTURE OF THE EMERGENCY DRUG INNOVATION NETWORK AND IDENTIFY INNOVATION ENTITIES WITH DIFFERENT RESEARCH AND DEVELOPMENT (R\&D) CAPABILITIES OR A FOUNDATION FOR COOPERATION. THIS STUDY ATTEMPTS TO PROVIDE THE BASIS FOR THEORIES AND POLICIES TO ACCELERATE R\&D OF EMERGENCY DRUGS. THE KEY RESULTS ARE AS FOLLOWS: (1) TECHNOLOGIES OF THE EMERGENCY DRUG INNOVATION NETWORK SHOW FLUCTUATING GROWTH ALIGNED CLOSELY WITH PUBLIC HEALTH EMERGENCIES. (2) THE NETWORK PRESENTS A SPARSE STRUCTURE WITH MANY ACTIVE FACTIONS, WHOSE MEMBERS HAVE THE ADVANTAGE OF COOPERATING. (3) THREE TYPES OF INNOVATION ENTITIES ARE IDENTIFIED: THE MAIN TECHNOLOGY SUPPLIERS, POTENTIAL SUPPLIERS OF OTHER SUPPORTING TECHNOLOGIES, AND PERIPHERAL SUPPLIERS OF OTHER SUPPORTING TECHNOLOGIES.","10.1093/scipol/scab087","0302-3427","SCIENCE AND PUBLIC POLICY","403-413","EVOLUTION OF THE EMERGENCY DRUG INNOVATION NETWORK AND POLICY IMPLICATIONS EVIDENCE FROM COVID19 DRUG PATENTS","49",2022,"ISI","Sci. Public Policy",0,"none",NA,NA,"XIA Q, 2022, Sci. Public Policy","XIA Q, 2022, Sci. Public Policy"
"GUO H, 2022, Int. J. Environ. Res. Public Health","GUO H;ZHANG J;FENG S;CHEN B;WANG M","THIS STUDY EXAMINED THE GLOBAL MEDIA CITATION NETWORK OF COVID-19-RELATED NEWS AT TWO STAGES OF THE PANDEMIC ALERT PHASE, I.E., THE NATIONAL LEVEL ALERT STAGE AND THE GLOBAL LEVEL ALERT STAGE. THE FINDINGS REVEAL THAT THE SMALL-WORLD PATTERN AND SCALE-FREE PROPERTY OF MEDIA CITATION NETWORKS CONTRIBUTED TO THE RAPID SPREAD OF COVID-19-RELATED NEWS AROUND THE WORLD. WITHIN THE NETWORKS, A SMALL NUMBER OF MEDIA OUTLETS FROM A FEW COUNTRIES FORMED THE BACKBONE OF THE NETWORK TO CONTROL THE RISK COMMUNICATION; MEANWHILE, MANY MEDIA OF GEOGRAPHICAL AND CULTURAL SIMILARITIES FORMED CROSS-BORDER COLLABORATIVE CLIQUES IN THE PERIPHERY OF THE NETWORK. WHEN THE ALERT PHASE ESCALATED FROM THE NATIONAL LEVEL TO THE GLOBAL LEVEL, THE NETWORK DEMONSTRATED A NUMBER OF CHANGES. THE FINDINGS CONTRIBUTE TO THE UNDERSTANDING OF RISK COMMUNICATION FOR INTERNATIONAL PUBLIC HEALTH EMERGENCIES BY TAKING INTO ACCOUNT THE NETWORK PERSPECTIVE AND EVOLUTIONARY NATURE OF PUBLIC HEALTH EMERGENCIES IN ANALYSIS.","10.3390/ijerph19159588",NA,"INTERNATIONAL JOURNAL OF ENVIRONMENTAL RESEARCH AND PUBLIC HEALTH",NA,"RISK COMMUNICATION IN THE ALERT PHASE OF THE COVID19 PANDEMIC ANALYSIS OF NEWS FLOW AT NATIONAL AND GLOBAL LEVELS","19",2022,"ISI","Int. J. Environ. Res. Public Health",0,"none",NA,NA,"GUO H, 2022, Int. J. Environ. Res. Public Health","GUO H, 2022, Int. J. Environ. Res. Public Health"
"VAN TONDER AJ, 2023, Microb. Genom.","VAN T A;MCCULLAGH F;MCKEAND S;BELLIS K;RAISEN C;LAY D;HOLMES M;PARKHILL J;HARRISON E;KUCHARSKI A;CONLAN A;CARRIAGE S T C","AGGREGATION OF CHILDREN IN SCHOOLS HAS BEEN ESTABLISHED TO BE A KEY DRIVER OF TRANSMISSION OF INFECTIOUS DISEASES. MATHEMATICAL MODELS OF TRANSMISSION USED TO PREDICT THE IMPACT OF CONTROL MEASURES, SUCH AS VACCINATION AND TESTING, COMMONLY DEPEND ON SELF-REPORTED CONTACT DATA. HOWEVER, THE LINK BETWEEN SELF-REPORTED SOCIAL CONTACTS AND PATHOGEN TRANSMISSION HAS NOT BEEN WELL DESCRIBED. TO ADDRESS THIS, WE USED STAPHYLOCOCCUS AUREUS AS A MODEL ORGANISM TO TRACK TRANSMISSION WITHIN TWO SECONDARY SCHOOLS IN ENGLAND AND TEST FOR ASSOCIATIONS BETWEEN SELF-REPORTED SOCIAL CONTACTS, TEST POSITIVITY AND THE BACTERIAL STRAIN COLLECTED FROM THE SAME STUDENTS. STUDENTS FILLED OUT A SOCIAL CONTACT SURVEY AND THEIR S. AUREUS COLONIZATION STATUS WAS ASCERTAINED THROUGH SELF-ADMINISTERED SWABS FROM WHICH ISOLATES WERE SEQUENCED. ISOLATES FROM THE LOCAL COMMUNITY WERE ALSO SEQUENCED TO ASSESS THE REPRESENTATIVENESS OF SCHOOL ISOLATES. A LOW FREQUENCY OF GENOME-LINKED TRANSMISSION PRECLUDED A FORMAL ANALYSIS OF LINKS BETWEEN GENOMIC AND SOCIAL NETWORKS, SUGGESTING THAT S. AUREUS TRANSMISSION WITHIN SCHOOLS IS TOO RARE TO MAKE IT A VIABLE TOOL FOR THIS PURPOSE. WHILST WE FOUND NO EVIDENCE THAT SCHOOLS ARE AN IMPORTANT ROUTE OF TRANSMISSION, INCREASED COLONIZATION RATES FOUND WITHIN SCHOOLS IMPLY THAT SCHOOL -AGE CHILDREN MAY BE AN IMPORTANT SOURCE OF COMMUNITY TRANSMISSION.","10.1099/mgen.0.000993","2057-5858","MICROBIAL GENOMICS",NA,"COLONIZATION AND TRANSMISSION OF ISTAPHYLOCOCCUS AUREUSI IN SCHOOLS A CITIZEN SCIENCE PROJECT","9",2023,"ISI","Microb. Genom.",0,"none",NA,NA,"VAN TONDER AJ, 2023, Microb. Genom.","VAN TONDER AJ, 2023, Microb. Genom."
"SKARDING J, 2021, IEEE Access","SKARDING J;GABRYS B;MUSIAL K","DYNAMIC NETWORKS ARE USED IN A WIDE RANGE OF FIELDS, INCLUDING SOCIAL NETWORK ANALYSIS, RECOMMENDER SYSTEMS AND EPIDEMIOLOGY. REPRESENTING COMPLEX NETWORKS AS STRUCTURES CHANGING OVER TIME ALLOW NETWORK MODELS TO LEVERAGE NOT ONLY STRUCTURAL BUT ALSO TEMPORAL PATTERNS. HOWEVER, AS DYNAMIC NETWORK LITERATURE STEMS FROM DIVERSE FIELDS AND MAKES USE OF INCONSISTENT TERMINOLOGY, IT IS CHALLENGING TO NAVIGATE. MEANWHILE, GRAPH NEURAL NETWORKS (GNNS) HAVE GAINED A LOT OF ATTENTION IN RECENT YEARS FOR THEIR ABILITY TO PERFORM WELL ON A RANGE OF NETWORK SCIENCE TASKS, SUCH AS LINK PREDICTION AND NODE CLASSIFICATION. DESPITE THE POPULARITY OF GRAPH NEURAL NETWORKS AND THE PROVEN BENEFITS OF DYNAMIC NETWORK MODELS, THERE HAS BEEN LITTLE FOCUS ON GRAPH NEURAL NETWORKS FOR DYNAMIC NETWORKS. TO ADDRESS THE CHALLENGES RESULTING FROM THE FACT THAT THIS RESEARCH CROSSES DIVERSE FIELDS AS WELL AS TO SURVEY DYNAMIC GRAPH NEURAL NETWORKS, THIS WORK IS SPLIT INTO TWO MAIN PARTS. FIRST, TO ADDRESS THE AMBIGUITY OF THE DYNAMIC NETWORK TERMINOLOGY WE ESTABLISH A FOUNDATION OF DYNAMIC NETWORKS WITH CONSISTENT, DETAILED TERMINOLOGY AND NOTATION. SECOND, WE PRESENT A COMPREHENSIVE SURVEY OF DYNAMIC GRAPH NEURAL NETWORK MODELS USING THE PROPOSED TERMINOLOGY.","10.1109/ACCESS.2021.3082932","2169-3536","IEEE ACCESS","79143-79168","FOUNDATIONS AND MODELING OF DYNAMIC NETWORKS USING DYNAMIC GRAPH NEURAL NETWORKS A SURVEY","9",2021,"ISI","IEEE Access",0,"none",NA,NA,"SKARDING J, 2021, IEEE Access","SKARDING J, 2021, IEEE Access"
"PROCHNOW T, 2020, J. Health Organ. Manag.","PROCHNOW T;PATTERSON M;SHARKEY J;UMSTATTD ;MEYER M","PURPOSE THE HEALTH EQUITY AND PROSPERITY OF COMMUNITIES IS CLOSELY LINKED TO THE EFFECTIVENESS AND SUCCESS OF LOCAL HEALTH COALITIONS. SOCIAL NETWORK ANALYSIS (SNA) IS ONE MECHANISM TO QUANTIFY AND UNDERSTAND THE FACTORS LEADING TO COLLABORATION AND EFFECTIVENESS WITHIN THESE COALITIONS. THIS STUDY AIMS TO INVESTIGATE NETWORK CHARACTERISTICS ASSOCIATED WITH PERCEIVED SUCCESS AND SATISFACTION IN A HEALTH COALITION AND DETERMINE SIGNIFICANT FACTORS RELATED TO ORGANIZATIONAL COLLABORATIONS. DESIGN/METHODOLOGY/APPROACH THIS STUDY EXAMINED THE OLYMPIC PENINSULA HEALTHY COMMUNITY COALITION (OPHCC) WHICH AIMS TO PREVENT CHRONIC DISEASE IN RURAL CLALLAM COUNTY, WASHINGTON. REPRESENTATIVES (N = 21) FROM MEMBER ORGANIZATIONS (N = 18) WERE ASKED TO REPORT ON ORGANIZATION CHARACTERISTICS, PERCEIVED SATISFACTION IN COALITION ACTIVITIES, PERCEIVED SUCCESS TOWARD COALITION'S MISSION, AND COLLABORATIONS WITH OTHER ORGANIZATIONS IN THE COALITION. MULTILEVEL MODELING USED TO ANALYZE WHETHER AN ORGANIZATION'S POSITION WITHIN THE COALITION NETWORK WAS ASSOCIATED WITH THEIR PERCEIVED SATISFACTION AND PERCEIVED SUCCESS. EXPONENTIAL RANDOM GRAPH MODELING WAS USED TO EXAMINE WHAT FACTORS MAY IMPACT COLLABORATION TIES BETWEEN COALITION MEMBERS. FINDINGS ORGANIZATION REPRESENTATIVES REPORTED A TOTAL OF 252 COLLABORATION TIES. IN MULTILEVEL MODELS, ORGANIZATION CHARACTERISTICS AND NETWORK CENTRALITY SCORES ACCOUNTED FOR BETWEEN 61 AND 68\% OF VARIANCE DISPLAYED IN SATISFACTION SCORES AND 45-61\% OF VARIANCE IN PERCEIVED SUCCESS SCORES. EXPONENTIAL RANDOM GRAPH MODELING REVEALED ACTIVITY LEVEL, FOR-PROFIT STATUS, AND TRANSITIVITY AS SIGNIFICANT FACTORS IN COLLABORATIVE TIE PRESENCE. ORIGINALITY/VALUE ENCOURAGING CONSISTENT ACTIVE PARTICIPATION, A BALANCE OF ORGANIZATIONAL TYPE, AND PROJECTS WHICH REQUIRE MORE THAN TWO COLLABORATORS MAY PROVIDE AN ENVIRONMENT FOR COLLABORATIVE TIES BETWEEN ORGANIZATIONS.","10.1108/JHOM-04-2020-0120","1477-7266","JOURNAL OF HEALTH ORGANIZATION AND MANAGEMENT","885-897","HEALTH COALITION COLLABORATION NETWORK PERCEIVED SATISFACTION AND SUCCESS","34",2020,"ISI","J. Health Organ. Manag.",0,"none",NA,NA,"PROCHNOW T, 2020, J. Health Organ. Manag.","PROCHNOW T, 2020, J. Health Organ. Manag."
"POWER DD, 2022, Eur. J. Public Health","POWER D;LAMBE B;MURPHY N","BACKGROUND PHYSICAL ACTIVITY (PA) LITERATURE IS DOMINATED BY INDIVIDUAL-LEVEL DESCRIPTIVE STUDIES, WHICH ARE KNOWN TO HAVE LIMITED IMPACT ON POPULATION PA LEVELS. LEVERAGING SYSTEMS SCIENCE METHODS OFFERS OPPORTUNITIES TO APPROACH PA IN A MANNER WHICH EMBRACES ITS INHERENT COMPLEXITY. THIS STUDY DESCRIBES HOW PARTICIPATORY SYSTEMS MAPPING AND SOCIAL NETWORK ANALYSIS (SNA) WERE USED TO UNDERSTAND THE WORK OF LOCAL AND NATIONAL LEVEL WALKING SYSTEMS IN IRELAND. METHODS TWO ADAPTED PARTICIPATORY ACTION RESEARCH WORKSHOPS WITH MULTISECTORAL STAKEHOLDERS WERE USED TO DEVELOP A SYSTEMS MAP FOR WALKING IN CORK, IRELAND. THE GLOBAL ACTION PLAN FOR PHYSICAL ACTIVITY 2018-2030 (GAPPA) MAP WAS USED AS A FRAMEWORK TO CATEGORIZE WORKSHOP OUTCOMES. SECONDLY, SNA METHODS WERE USED TO ANALYSE THE COMMUNICATION NETWORK BETWEEN PARTNERS OF GET IRELAND WALKING, A NATIONAL WALKING PROMOTION INITIATIVE, AS DEFINED WITHIN THEIR STRATEGIC PLAN AND THE ACTUAL COMMUNICATION NETWORK AS EXPERIENCED BY THE PARTNERS. RESULTS THE SYSTEMS MAPPING PROCESS ALLOWED STAKEHOLDERS TO IDENTIFY 19 SUGGESTED ACTIONS FOR THE CORK WALKING SYSTEM. THE SNA FOUND THAT THERE WERE CONSIDERABLY FEWER COMMUNICATION TIES BETWEEN PARTNERS IN THE ACTUAL COMMUNICATION NETWORK THAN IN THE STRATEGY DEFINED NETWORK. CONCLUSION THE SYSTEMS MAPPING PROCESS WAS A USEFUL CATALYST FOR ENGAGING STAKEHOLDERS IN CROSS-SECTORAL COMMUNICATION AND THE GAPPA WAS A PRACTICAL WAY TO ORGANIZE WORKSHOP OUTCOMES. SOCIAL NETWORK ANALYSIS METHODS HIGHLIGHTED THAT THE COMMUNICATION NETWORK OF A NATIONAL LEVEL WALKING PROMOTION PARTNERSHIP IS NOT WORKING AS PLANNED. OVERALL, THE USE OF SYSTEMS SCIENCE METHODS CAN PROVIDE PRACTICAL INSIGHTS FOR LOCAL AND NATIONAL LEVEL WALKING SYSTEMS.","10.1093/eurpub/ckac076","1101-1262","EUROPEAN JOURNAL OF PUBLIC HEALTH","I8-I13","USING SYSTEMS SCIENCE METHODS TO ENHANCE THE WORK OF NATIONAL AND LOCAL WALKING PARTNERSHIPS PRACTICAL INSIGHTS FROM IRELAND","32",2022,"ISI","Eur. J. Public Health",0,"none",NA,NA,"POWER DD, 2022, Eur. J. Public Health","POWER DD, 2022, Eur. J. Public Health"
"MARQUES-SANCHEZ P, 2021, BMJ OPEN","MARQUES-SANCHEZ P;BENITEZ-ANDRADES J;CALVO ;SANCHEZ M;ARIAS N","OBJECTIVES TO ANALYSE THE PHYSICAL ACTIVITY CARRIED OUT BY THE ADOLESCENTS IN THE STUDY, ITS RELATIONSHIP TO BEING OVERWEIGHT (OVERWEIGHT+OBESE) AND TO ANALYSE THE STRUCTURE OF THE SOCIAL NETWORK OF FRIENDSHIP ESTABLISHED IN ADOLESCENTS DOING GROUP SPORTS, USING DIFFERENT PARAMETERS INDICATIVE OF CENTRALITY. SETTING IT WAS CARRIED OUT IN AN EDUCATIONAL ENVIRONMENT, IN 11 CLASSROOMS BELONGING TO 5 SCHOOLS IN PONFERRADA (SPAIN). PARTICIPANTS 235 ADOLESCENTS WERE INCLUDED IN THE STUDY (49.4\% FEMALE), WHO WERE CLASSIFIED AS NORMAL WEIGHT OR OVERWEIGHT. PRIMARY AND SECONDARY OUTCOME MEASURES PHYSICAL ACTIVITY QUESTIONNAIRE FOR ADOLESCENTS (PAQ-A) WAS USED TO STUDY THE LEVEL OF PHYSICAL ACTIVITY. A SOCIAL NETWORK ANALYSIS WAS CARRIED OUT TO ANALYSE STRUCTURAL VARIABLES OF CENTRALITY IN DIFFERENT DEGREES OF CONTACT. RESULTS 30.2\% OF THE PARTICIPANTS IN OUR STUDY WERE OVERWEIGHT. RELATIVE TO FEMALE PARTICIPANTS IN THIS STUDY, MALES OBTAINED SIGNIFICANTLY HIGHER SCORES IN THE PAQ-A (OR: 2.11; 95\% CI: 1.04 TO 4.25; P VALUE: 0.036) AND WERE MORE LIKELY TO PARTICIPATE IN GROUP SPORT (OR: 4.59; 95\% CI: 2.28 TO 9.22; P VALUE: 0.000). WE FOUND NO SIGNIFICANT RELATIONSHIP BETWEEN PHYSICAL ACTIVITY AND THE WEIGHT STATUS IN THE TOTAL SAMPLE, BUT AMONG FEMALE PARTICIPANTS, THOSE WITH OVERWEIGHT STATUS HAD HIGHER ODDS OF REPORTING HIGH LEVELS OF PHYSICAL EXERCISE (OR: 4.50; 95\% CI: 1.21 TO 16.74; P VALUE: 0.025). IN TERMS OF CENTRALITY, DIFFERENTIATING BY GENDER, WOMEN WHO PARTICIPATED IN GROUP SPORTS WERE MORE LIKELY TO BE CLASSIFIED AS HAVING LOW VALUES OF CENTRALITY, WHILE THE OPPOSITE EFFECT OCCURRED FOR MEN, MORE LIKELY TO BE CLASSIFIED AS HAVING HIGH VALUES OF CENTRALITY. CONCLUSIONS OUR FINDINGS, WITH LIMITATIONS, UNDERLINE THE IMPORTANCE OF TWO FUNDAMENTAL ASPECTS TO BE TAKEN INTO ACCOUNT IN THE DESIGN OF FUTURE STRATEGIES: GENDER AND THE CENTRALITY WITHIN THE SOCIAL NETWORK DEPENDING ON THE INTENSITY OF CONTACT THEY HAVE WITH THEIR PEERS.","10.1136/bmjopen-2020-042773","2044-6055","BMJ OPEN",NA,"THE SOCIALISATION OF THE ADOLESCENT WHO CARRIES OUT TEAM SPORTS A TRANSVERSAL STUDY OF CENTRALITY WITH A SOCIAL NETWORK ANALYSIS","11",2021,"ISI","BMJ OPEN",0,"none",NA,NA,"MARQUES-SANCHEZ P, 2021, BMJ OPEN","MARQUES-SANCHEZ P, 2021, BMJ OPEN"
