"","AU","AB","DI","SN","SO","PP","TI","VL","PY","DB","J9","TC","CR","C1","AU_UN","SR_FULL","SR"
"KIM KD, 2022, CIRC CARDIOVASC QUAL OUTCOMES","KIM K;FUNK R;HOU H;AIRHART A;NASSAR K;PAGANI F;ZHANG M;CHANDANABHUMMA P;AARONSON K;CHENOWETH C;HIDER A;CABRERA L;LIKOSKY D","BACKGROUND: CARE FRAGMENTATION IS ASSOCIATED WITH HIGHER RATES OF INFECTION AFTER DURABLE LEFT VENTRICULAR ASSIST DEVICE (LVAD) IMPLANT. LESS IS KNOWN ABOUT THE RELATIONSHIP BETWEEN CARE FRAGMENTATION AND TOTAL SPENDING, AND WHETHER THIS RELATIONSHIP IS MEDIATED BY INFECTIONS. METHODS: TOTAL PAYMENTS WERE CAPTURED FROM ADMISSION TO 180 DAYS POST-DISCHARGE. DRAWING ON NETWORK THEORY, A MEASURE OF CARE FRAGMENTATION WAS DEVELOPED BASED ON THE NUMBER OF SHARED PATIENTS AMONG PROVIDERS (IE, ANESTHESIOLOGISTS, CARDIAC SURGEONS, CARDIOLOGISTS, CRITICAL CARE SPECIALISTS, NURSE PRACTITIONERS, PHYSICIAN ASSISTANTS) CARING FOR 4,987 MEDICARE BENEFICIARIES UNDERGOING LVAD IMPLANTATION BETWEEN JULY 2009 - APRIL 2017. CARE FRAGMENTATION WAS MEASURED USING AVERAGE PATH LENGTH, WHICH DESCRIBES HOW EFFICIENTLY INFORMATION FLOWS AMONG NETWORK MEMBERS; LONGER PATH LENGTH INDICATES GREATER FRAGMENTATION. TERCILES BASED ON THE LEVEL OF CARE FRAGMENTATION AND MULTIVARIABLE REGRESSION WERE USED TO ANALYZE THE RELATIONSHIP BETWEEN CARE FRAGMENTATION AND LVAD PAYMENTS AND MEDIATION ANALYSIS WAS USED TO EVALUATE THE ROLE OF POST-IMPLANT INFECTIONS. RESULTS: THE PATIENT COHORT WAS 81% MALE, 73% WHITE, 11% INTERMACS PROFILE 1 WITH MEAN (SD) AGE OF 63.1 YEARS (11.1). THE MEAN (SD) LEVEL OF CARE FRAGMENTATION IN PROVIDER NETWORKS WAS 1.7 (0.2) AND MEAN (SD) PAYMENT FROM ADMISSION TO 180 DAYS POST-DISCHARGE WAS $246,905 ($109,872). MEAN (SD) TOTAL PAYMENTS AT THE LOWER, MIDDLE, AND UPPER TERCILES OF CARE FRAGMENTATION WERE $250,135 ($111,924), $243,288 ($109,376), AND $247,290 ($108,241), RESPECTIVELY. IN MEDIATION ANALYSIS, THE INDIRECT EFFECT OF CARE FRAGMENTATION ON TOTAL PAYMENTS, THROUGH INFECTIONS, WAS POSITIVE AND STATISTICALLY SIGNIFICANT (=16032.5, P=0.008). CONCLUSIONS: GREATER CARE FRAGMENTATION IN THE DELIVERY OF CARE SURROUNDING DURABLE LVAD IMPLANTATION IS ASSOCIATED WITH A HIGHER INCIDENCE OF INFECTIONS, AND CONSEQUENTLY, HIGHER PAYMENTS FOR MEDICARE BENEFICIARIES. INTERVENTIONS TO REDUCE CARE FRAGMENTATION MAY REDUCE THE INCIDENCE OF INFECTIONS AND IN TURN ENHANCE THE VALUE OF CARE FOR PATIENTS UNDERGOING DURABLE LVAD IMPLANTATION.","10.1161/CIRCOUTCOMES.121.008592","1941-7705 (ELECTRONIC) 1941-7713 (PRINT) 1941-7713 (LINKING)","CIRCULATION. CARDIOVASCULAR QUALITY AND OUTCOMES","E008592","ASSOCIATION BETWEEN CARE FRAGMENTATION AND TOTAL SPENDING AFTER DURABLE LEFT VENTRICULAR DEVICE IMPLANT A MEDIATION ANALYSIS OF HEALTH CAREASSOCIATED INFECTIONS WITHIN A NATIONAL MEDICARESOCIETY OF THORACIC SURGEONS INTERMACS LINKED DATASET","15",2022,"ISI","CIRC CARDIOVASC QUAL OUTCOMES",0,"none","STRATEGY, ETHICS, AND ENTREPRENEURSHIP, DARDEN SCHOOL OF BUSINESS, UNIVERSITY OF VIRGINIA, CHARLOTTESVILLE (K.;D.;K.;).; DEPARTMENT OF STRATEGIC MANAGEMENT AND ENTREPRENEURSHIP, CARLSON SCHOOL OF MANAGEMENT, UNIVERSITY OF MINNESOTA, MINNEAPOLIS (R.;J.;F.;).; DEPARTMENT OF CARDIAC SURGERY, MICHIGAN MEDICINE (H.;H.;, F.;D.;P.;, L.;C.;, D.;S.;L.;).; UNIVERSITY OF MICHIGAN MEDICAL SCHOOL, ANN ARBOR (A.;A.;, A.;H.;).; UNIVERSITY HOSPITAL, MICHIGAN MEDICINE (K.;N.;), UNIVERSITY OF MICHIGAN, ANN ARBOR.; DEPARTMENT OF CARDIAC SURGERY, MICHIGAN MEDICINE (H.;H.;, F.;D.;P.;, L.;C.;, D.;S.;L.;).; DEPARTMENT OF BIOSTATISTICS, SCHOOL OF PUBLIC HEALTH, UNIVERSITY OF MICHIGAN, ANN ARBOR (M.;Z.;).; MIXED METHODS PROGRAM, DEPARTMENT OF FAMILY MEDICINE (P.;P.;C.;), UNIVERSITY OF MICHIGAN, ANN ARBOR.; DIVISION OF CARDIOVASCULAR MEDICINE, DEPARTMENT OF INTERNAL MEDICINE, MICHIGAN MEDICINE (K.;D.;A.;), UNIVERSITY OF MICHIGAN, ANN ARBOR.; DIVISION OF INFECTIOUS DISEASES, DEPARTMENT OF INTERNAL MEDICINE, MICHIGAN MEDICINE (C.;E.;C.;), UNIVERSITY OF MICHIGAN, ANN ARBOR.; UNIVERSITY OF MICHIGAN MEDICAL SCHOOL, ANN ARBOR (A.;A.;, A.;H.;).; DEPARTMENT OF CARDIAC SURGERY, MICHIGAN MEDICINE (H.;H.;, F.;D.;P.;, L.;C.;, D.;S.;L.;).; DEPARTMENT OF CARDIAC SURGERY, MICHIGAN MEDICINE (H.;H.;, F.;D.;P.;, L.;C.;, D.;S.;L.;).;","UNIVERSITY OF VIRGINIA;UNIVERSITY OF MINNESOTA;UNIVERSITY OF MICHIGAN MEDICAL SCHOOL;UNIVERSITY HOSPITAL;UNIVERSITY OF MICHIGAN;UNIVERSITY OF MICHIGAN;UNIVERSITY OF MICHIGAN;UNIVERSITY OF MICHIGAN;UNIVERSITY OF MICHIGAN;UNIVERSITY OF MICHIGAN MEDICAL SCHOOL","KIM KD, 2022, CIRC CARDIOVASC QUAL OUTCOMES","KIM KD, 2022, CIRC CARDIOVASC QUAL OUTCOMES"
"HOFFMAN BL, 2019, VACCINE","HOFFMAN B;FELTER E;CHU K;SHENSA A;HERMANN C;WOLYNN T;WILLIAMS D;PRIMACK B","BACKGROUND: DUE IN PART TO DECLINING VACCINATION RATES, IN 2018 OVER 20 STATES REPORTED AT LEAST ONE CASE OF MEASLES, AND OVER 40,000 CASES WERE CONFIRMED IN EUROPE. ANTI-VACCINE POSTS ON SOCIAL MEDIA MAY BE FACILITATING ANTI-VACCINATION BEHAVIOUR. THIS STUDY AIMED TO SYSTEMATICALLY CHARACTERIZE (1) INDIVIDUALS KNOWN TO PUBLICLY POST ANTI-VACCINATION CONTENT ON FACEBOOK, (2) THE INFORMATION THEY CONVEY, AND (3) THE SPREAD OF THIS CONTENT. METHODS: OUR DATA SET CONSISTED OF 197 INDIVIDUALS WHO POSTED ANTI-VACCINATION COMMENTS IN RESPONSE TO A MESSAGE PROMOTING VACCINATION. WE SYSTEMATICALLY ANALYSED PUBLICLY-AVAILABLE CONTENT USING QUANTITATIVE CODING, DESCRIPTIVE ANALYSIS, SOCIAL NETWORK ANALYSIS, AND AN IN-DEPTH QUALITATIVE ASSESSMENT. THE FINAL CODEBOOK CONSISTED OF 26 CODES; COHEN'S  RANGED 0.71-1.0 AFTER DOUBLE-CODING. RESULTS: THE MAJORITY (89%) OF INDIVIDUALS IDENTIFIED AS FEMALE. AMONG 136 INDIVIDUALS WHO DIVULGED THEIR LOCATION, 36 STATES AND 8 OTHER COUNTRIES WERE REPRESENTED. IN A 2-MODE NETWORK OF INDIVIDUALS AND TOPICS, MODULARITY ANALYSIS REVEALED 4 DISTINCT SUB-GROUPS LABELLED AS ""TRUST,"" ""ALTERNATIVES,"" ""SAFETY,"" AND ""CONSPIRACY."" FOR EXAMPLE, A COMMENT REPRESENTATIVE OF ""CONSPIRACY"" IS THAT POLIOVIRUS DOES NOT EXIST AND THAT PESTICIDES CAUSED CLINICAL SYMPTOMS OF POLIO. AN EXAMPLE FROM THE ""ALTERNATIVES"" SUB-GROUP IS THAT EATING YOGURT CURES HUMAN PAPILLOMAVIRUS. DEEPER QUALITATIVE ANALYSIS OF ALL 197 INDIVIDUALS' PROFILES FOUND THAT THESE INDIVIDUALS ALSO TENDED TO POST MATERIAL AGAINST OTHER HEALTH-RELATED PRACTICES SUCH AS WATER FLUORIDATION AND CIRCUMCISION. CONCLUSIONS: SOCIAL MEDIA OUTLETS MAY FACILITATE ANTI-VACCINATION CONNECTIONS AND ORGANIZATION BY FACILITATING THE DIFFUSION OF CENTURIES OLD ARGUMENTS AND TECHNIQUES. ARGUMENTS AGAINST VACCINATION ARE DIVERSE BUT REMAIN CONSISTENT WITHIN SUB-GROUPS OF INDIVIDUALS. IT WOULD BE VALUABLE FOR HEALTH PROFESSIONALS TO LEVERAGE SOCIAL NETWORKS TO DELIVER MORE EFFECTIVE, TARGETED MESSAGES TO DIFFERENT CONSTITUENCIES.","S0264-410X(19)30303-2","1873-2518 (ELECTRONIC) 0264-410X (LINKING)","VACCINE","2216-2223","ITS NOT ALL ABOUT AUTISM THE EMERGING LANDSCAPE OF ANTIVACCINATION SENTIMENT ON FACEBOOK","37",2019,"ISI","VACCINE",0,"none","DIVISION OF GENERAL INTERNAL MEDICINE, DEPARTMENT OF MEDICINE, UNIVERSITY OF PITTSBURGH SCHOOL OF MEDICINE, 1218 SCAIFE HALL, 35505 TERRACE STREET, PITTSBURGH, PA 15261, UNITED STATES; CENTER FOR RESEARCH ON MEDIA, TECHNOLOGY, AND HEALTH, UNIVERSITY OF PITTSBURGH SCHOOL OF MEDICINE, 230 MCKEE PLACE, SUITE 600, PITTSBURGH, PA 15213, UNITED STATES; DEPARTMENT OF BEHAVIORAL AND COMMUNITY HEALTH SCIENCES, GRADUATE SCHOOL OF PUBLIC HEALTH, UNIVERSITY OF PITTSBURGH, 130 DE SOTO STREET, PITTSBURGH, PA 15261, UNITED STATES.; ELECTRONIC ADDRESS: BLH72@PITT.;EDU.; DEPARTMENT OF BEHAVIORAL AND COMMUNITY HEALTH SCIENCES, GRADUATE SCHOOL OF PUBLIC HEALTH, UNIVERSITY OF PITTSBURGH, 130 DE SOTO STREET, PITTSBURGH, PA 15261, UNITED STATES.; ELECTRONIC ADDRESS: EMFELTER@PITT.;EDU.; DIVISION OF GENERAL INTERNAL MEDICINE, DEPARTMENT OF MEDICINE, UNIVERSITY OF PITTSBURGH SCHOOL OF MEDICINE, 1218 SCAIFE HALL, 35505 TERRACE STREET, PITTSBURGH, PA 15261, UNITED STATES; CENTER FOR RESEARCH ON MEDIA, TECHNOLOGY, AND HEALTH, UNIVERSITY OF PITTSBURGH SCHOOL OF MEDICINE, 230 MCKEE PLACE, SUITE 600, PITTSBURGH, PA 15213, UNITED STATES; DIVISION OF ADOLESCENT MEDICINE, DEPARTMENT OF PEDIATRICS, UNIVERSITY OF PITTSBURGH SCHOOL OF MEDICINE, 1218 SCAIFE HALL, 35505 TERRACE STREET, PITTSBURGH, PA 15261, UNITED STATES.; ELECTRONIC ADDRESS: CHUK@PITT.;EDU.; DIVISION OF GENERAL INTERNAL MEDICINE, DEPARTMENT OF MEDICINE, UNIVERSITY OF PITTSBURGH SCHOOL OF MEDICINE, 1218 SCAIFE HALL, 35505 TERRACE STREET, PITTSBURGH, PA 15261, UNITED STATES; CENTER FOR RESEARCH ON MEDIA, TECHNOLOGY, AND HEALTH, UNIVERSITY OF PITTSBURGH SCHOOL OF MEDICINE, 230 MCKEE PLACE, SUITE 600, PITTSBURGH, PA 15213, UNITED STATES.; ELECTRONIC ADDRESS: ARIEL.;SHENSA@PITT.;EDU.; KIDS PLUS PEDIATRICS, 4070 BEECHWOOD BLVD.;, PITTSBURGH, PA 15217, UNITED STATES.; ELECTRONIC ADDRESS: CHAD@KIDSPLUSPGH.;COM.; KIDS PLUS PEDIATRICS, 4070 BEECHWOOD BLVD.;, PITTSBURGH, PA 15217, UNITED STATES.; ELECTRONIC ADDRESS: TODD@KIDSPLUSPGH.;COM.; CENTER FOR RESEARCH ON MEDIA, TECHNOLOGY, AND HEALTH, UNIVERSITY OF PITTSBURGH SCHOOL OF MEDICINE, 230 MCKEE PLACE, SUITE 600, PITTSBURGH, PA 15213, UNITED STATES.; ELECTRONIC ADDRESS: DCW36@PITT.;EDU.; DIVISION OF GENERAL INTERNAL MEDICINE, DEPARTMENT OF MEDICINE, UNIVERSITY OF PITTSBURGH SCHOOL OF MEDICINE, 1218 SCAIFE HALL, 35505 TERRACE STREET, PITTSBURGH, PA 15261, UNITED STATES; CENTER FOR RESEARCH ON MEDIA, TECHNOLOGY, AND HEALTH, UNIVERSITY OF PITTSBURGH SCHOOL OF MEDICINE, 230 MCKEE PLACE, SUITE 600, PITTSBURGH, PA 15213, UNITED STATES; HEALTH POLICY INSTITUTE, UNIVERSITY OF PITTSBURGH, 311 SCAIFE HALL, 3550 TERRACE STREET, PITTSBURGH, PA 15261, UNITED STATES; DIVISION OF ADOLESCENT MEDICINE, DEPARTMENT OF PEDIATRICS, UNIVERSITY OF PITTSBURGH SCHOOL OF MEDICINE, 1218 SCAIFE HALL, 35505 TERRACE STREET, PITTSBURGH, PA 15261, UNITED STATES.; ELECTRONIC ADDRESS: BPRIMACK@PITT.;EDU.;","UNIVERSITY OF PITTSBURGH SCHOOL OF MEDICINE;UNIVERSITY OF PITTSBURGH SCHOOL OF MEDICINE;UNIVERSITY OF PITTSBURGH;UNIVERSITY OF PITTSBURGH;ELECTRONIC ADDRESS: EMFELTER@PITT.;UNIVERSITY OF PITTSBURGH SCHOOL OF MEDICINE;UNIVERSITY OF PITTSBURGH SCHOOL OF MEDICINE;UNIVERSITY OF PITTSBURGH SCHOOL OF MEDICINE;ELECTRONIC ADDRESS: CHUK@PITT.;UNIVERSITY OF PITTSBURGH SCHOOL OF MEDICINE;UNIVERSITY OF PITTSBURGH SCHOOL OF MEDICINE;ELECTRONIC ADDRESS: ARIEL.;ELECTRONIC ADDRESS: CHAD@KIDSPLUSPGH.;ELECTRONIC ADDRESS: TODD@KIDSPLUSPGH.;UNIVERSITY OF PITTSBURGH SCHOOL OF MEDICINE;UNIVERSITY OF PITTSBURGH SCHOOL OF MEDICINE;UNIVERSITY OF PITTSBURGH SCHOOL OF MEDICINE;UNIVERSITY OF PITTSBURGH;UNIVERSITY OF PITTSBURGH SCHOOL OF MEDICINE;ELECTRONIC ADDRESS: BPRIMACK@PITT.","HOFFMAN BL, 2019, VACCINE","HOFFMAN BL, 2019, VACCINE"
"MARQUS-SNCHEZ P, 2021, SCI REP","MARQUS-SNCHEZ P;PINTO-CARRAL A;FERNNDEZ-VILLA T;VZQUEZ-CASARES A;LIBANA-PRESA C;BENTEZ-ANDRADES J","(I) ANALYZE CONNECTIVITY BETWEEN SUBGROUPS OF UNIVERSITY STUDENTS, (II) ASSESS WHICH BRIDGES OF RELATIONAL CONTACTS ARE ESSENTIAL FOR CONNECTING OR DISCONNECTING SUBGROUPS AND (III) TO EXPLORE THE SIMILARITIES BETWEEN THE ATTRIBUTES OF THE SUBGROUP NODES IN RELATION TO THE PANDEMIC CONTEXT. DURING THE COVID-19 PANDEMIC, YOUNG UNIVERSITY STUDENTS HAVE EXPERIENCED SIGNIFICANT CHANGES IN THEIR RELATIONSHIPS, ESPECIALLY IN THE HALLS OF RESIDENCE. PREVIOUS RESEARCH HAS SHOWN THE IMPORTANCE OF RELATIONSHIP STRUCTURE IN CONTAGION PROCESSES. HOWEVER, THERE IS A LACK OF STUDIES IN THE UNIVERSITY SETTING, WHERE STUDENTS LIVE CLOSELY TOGETHER. THE CASE STUDY METHODOLOGY WAS APPLIED TO CARRY OUT A DESCRIPTIVE STUDY. THE PARTICIPATION CONSISTED OF 43 UNIVERSITY STUDENTS LIVING IN THE SAME HALL OF RESIDENCE. SOCIAL NETWORK ANALYSIS HAS BEEN APPLIED FOR DATA ANALYSIS. FACTIONS AND GIRVAN-NEWMAN ALGORITHMS HAVE BEEN APPLIED TO DETECT THE EXISTING COHESIVE SUBGROUPS. THE UCINET TOOL WAS USED FOR THE CALCULATION OF THE SNA MEASURE. A VISUALIZATION OF THE GLOBAL NETWORK WILL BE CARRIED OUT USING GEPHI SOFTWARE. AFTER APPLYING THE GIRVAN-NEWMAN AND FACTIONS, IN BOTH CASES IT WAS FOUND THAT THE BEST DIVISION INTO SUBGROUPS WAS THE ONE THAT DIVIDED THE NETWORK INTO 4 SUBGROUPS. THERE IS HIGH DEGREE OF COHESION WITHIN THE SUBGROUPS AND A LOW COHESION BETWEEN THEM. THE RELATIONSHIP BETWEEN SUBGROUP MEMBERSHIP AND GENDER WAS SIGNIFICANT. THE DEGREE OF COVID-19 INFECTION IS RELATED TO THE DEGREE OF CLUSTERING BETWEEN THE STUDENTS. COLLEGE STUDENTS FORM SUBGROUPS IN THEIR RESIDENCE. SOCIAL NETWORK ANALYSIS FACILITATES AN UNDERSTANDING OF STRUCTURAL BEHAVIOR DURING THE PANDEMIC. THE STUDY PROVIDES EVIDENCE ON THE IMPORTANCE OF GENDER, RACE AND THE BUILDING WHERE THEY LIVE IN CREATING NETWORK STRUCTURES THAT FAVOR, OR NOT, CONTAGION DURING A PANDEMIC.","10.1038/S41598-021-01390-4","2045-2322 (ELECTRONIC) 2045-2322 (LINKING)","SCIENTIFIC REPORTS","22055","IDENTIFICATION OF COHESIVE SUBGROUPS IN A UNIVERSITY HALL OF RESIDENCE DURING THE COVID19 PANDEMIC USING A SOCIAL NETWORK ANALYSIS APPROACH","11",2021,"ISI","SCI REP",0,"none","SALBIS RESEARCH GROUP, DEPARTMENT OF NURSING AND PHYSIOTHERAPY, UNIVERSIDAD DE LEN, CAMPUS DE PONFERRADA S/N, 24400, PONFERRADA, SPAIN.; SALBIS RESEARCH GROUP, DEPARTMENT OF NURSING AND PHYSIOTHERAPY, UNIVERSIDAD DE LEN, CAMPUS DE PONFERRADA S/N, 24400, PONFERRADA, SPAIN.; APINC@UNILEON.;ES.; THE RESEARCH GROUP IN GEN-ENVIRONMENT AND HEALTH INTERACTIONS (GIIGAS), INSTITUTE OF BIOMEDICINE (IBIOMED), UNIVERSIDAD DE LEN, 24071, LEN, SPAIN.; DEPARTMENT OF NURSING AND PHYSIOTHERAPY, UNIVERSIDAD DE LEN, CAMPUS DE VEGAZANA S/N, 24071, LEN, SPAIN.; SALBIS RESEARCH GROUP, DEPARTMENT OF NURSING AND PHYSIOTHERAPY, UNIVERSIDAD DE LEN, CAMPUS DE PONFERRADA S/N, 24400, PONFERRADA, SPAIN.; SALBIS RESEARCH GROUP, DEPARTMENT OF ELECTRIC, SYSTEMS AND AUTOMATICS ENGINEERING, UNIVERSIDAD DE LEN, CAMPUS OF VEGAZANA S/N, 24071, LEN, SPAIN.;","UNIVERSIDAD DE LEN;UNIVERSIDAD DE LEN;UNIVERSIDAD DE LEN;UNIVERSIDAD DE LEN;UNIVERSIDAD DE LEN;UNIVERSIDAD DE LEN","MARQUS-SNCHEZ P, 2021, SCI REP","MARQUS-SNCHEZ P, 2021, SCI REP"
"PETROS BA, 2022, MED","PETROS B;PAULL J;TOMKINS-TINCH C;LOFTNESS B;DERUFF K;NAIR P;GIONET G;BENZ A;BROCK-FISHER T;HUGHES M;YURKOVETSKIY L;MULAUDZI S;LEENERMAN E;NYALILE T;MORENO G;SPECHT I;SANI K;ADAMS G;BABET S;BARON E;BLANK J;BOEHM C;BOTTI-LODOVICO Y;BROWN J;BUISKER A;BURCHAM T;CHYLEK L;CRONAN P;DAUPHIN A;DESREUMAUX V;DOSS M;FLYNN B;GLADDEN-YOUNG A;GLENNON O;HARMON H;HOOK T;KARY A;KING C;LORETH C;MARRS L;MCQUADE K;MILTON T;MULFORD J;OBA K;PEARLMAN L;SCHIFFERLI M;SCHMIDT M;TANDUS G;TYLER A;VODZAK M;KROHN B K;COLUBRI A;MACINNIS B;OZSOY A;PARRIE E;SHOLTES K;SIDDLE K;FRY B;LUBAN J;PARK D;MARSHALL J;BRONSON A;SCHAFFNER S;SABETI P","BACKGROUND: UNIVERSITIES ARE VULNERABLE TO INFECTIOUS DISEASE OUTBREAKS, MAKING THEM IDEAL ENVIRONMENTS TO STUDY TRANSMISSION DYNAMICS AND EVALUATE MITIGATION AND SURVEILLANCE MEASURES. HERE, WE ANALYZE MULTIMODAL COVID-19-ASSOCIATED DATA COLLECTED DURING THE 2020-2021 ACADEMIC YEAR AT COLORADO MESA UNIVERSITY AND INTRODUCE A SARS-COV-2 SURVEILLANCE AND RESPONSE FRAMEWORK. METHODS: WE ANALYZED EPIDEMIOLOGICAL AND SOCIOBEHAVIORAL DATA (DEMOGRAPHICS, CONTACT TRACING, AND WIFI-BASED CO-LOCATION DATA) ALONGSIDE PATHOGEN SURVEILLANCE DATA (WASTEWATER AND DIAGNOSTIC TESTING, AND VIRAL GENOMIC SEQUENCING OF WASTEWATER AND CLINICAL SPECIMENS) TO CHARACTERIZE OUTBREAK DYNAMICS AND INFORM POLICY. WE APPLIED RELATIVE RISK, MULTIPLE LINEAR REGRESSION, AND SOCIAL NETWORK ASSORTATIVITY TO IDENTIFY ATTRIBUTES OR BEHAVIORS ASSOCIATED WITH CONTRACTING SARS-COV-2. TO CHARACTERIZE SARS-COV-2 TRANSMISSION, WE USED VIRAL SEQUENCING, PHYLOGENOMIC TOOLS, AND FUNCTIONAL ASSAYS. FINDINGS: ATHLETES, PARTICULARLY THOSE ON HIGH-CONTACT TEAMS, HAD THE HIGHEST RISK OF TESTING POSITIVE. ON AVERAGE, INDIVIDUALS WHO TESTED POSITIVE HAD MORE CONTACTS AND LONGER INTERACTION DURATIONS THAN INDIVIDUALS WHO NEVER TESTED POSITIVE. THE DISTRIBUTION OF CONTACTS PER INDIVIDUAL WAS OVERDISPERSED, ALTHOUGH NOT AS OVERDISPERSED AS THE DISTRIBUTION OF PHYLOGENOMIC DESCENDANTS. CORROBORATION VIA TECHNICAL REPLICATES WAS ESSENTIAL FOR IDENTIFICATION OF WASTEWATER MUTATIONS. CONCLUSIONS: BASED ON OUR FINDINGS, WE FORMULATE A FRAMEWORK THAT COMBINES TOOLS INTO AN INTEGRATED DISEASE SURVEILLANCE PROGRAM THAT CAN BE IMPLEMENTED IN OTHER CONGREGATE SETTINGS WITH LIMITED RESOURCES. FUNDING: THIS WORK WAS SUPPORTED BY THE NATIONAL SCIENCE FOUNDATION, THE HERTZ FOUNDATION, THE NATIONAL INSTITUTES OF HEALTH, THE CENTERS FOR DISEASE CONTROL AND PREVENTION, THE MASSACHUSETTS CONSORTIUM ON PATHOGEN READINESS, THE HOWARD HUGHES MEDICAL INSTITUTE, THE FLU LAB, AND THE AUDACIOUS PROJECT.","S2666-6340(22)00404-4","2666-6340 (ELECTRONIC) 2666-6359 (PRINT) 2666-6340 (LINKING)","MED (NEW YORK, N.Y.)","883-900.E13","MULTIMODAL SURVEILLANCE OF SARSCOV2 AT A UNIVERSITY ENABLES DEVELOPMENT OF A ROBUST OUTBREAK RESPONSE FRAMEWORK","3",2022,"ISI","MED",0,"none","BROAD INSTITUTE OF MIT AND HARVARD, CAMBRIDGE, MA 02142, USA; HARVARD-MIT PROGRAM IN HEALTH SCIENCES AND TECHNOLOGY, CAMBRIDGE, MA 02139, USA; HARVARD/MIT MD-PHD PROGRAM, BOSTON, MA 02115, USA; SYSTEMS, SYNTHETIC, AND QUANTITATIVE BIOLOGY PHD PROGRAM, DEPARTMENT OF SYSTEMS BIOLOGY, HARVARD MEDICAL SCHOOL, BOSTON, MA 02115, USA.; BROAD INSTITUTE OF MIT AND HARVARD, CAMBRIDGE, MA 02142, USA; SYSTEMS, SYNTHETIC, AND QUANTITATIVE BIOLOGY PHD PROGRAM, DEPARTMENT OF SYSTEMS BIOLOGY, HARVARD MEDICAL SCHOOL, BOSTON, MA 02115, USA.; ELECTRONIC ADDRESS: JPAULL@BROADINSTITUTE.;ORG.; BROAD INSTITUTE OF MIT AND HARVARD, CAMBRIDGE, MA 02142, USA; DEPARTMENT OF ORGANISMIC AND EVOLUTIONARY BIOLOGY, HARVARD UNIVERSITY, CAMBRIDGE, MA 02138, USA.; ELECTRONIC ADDRESS: TOMKINSC@BROADINSTITUTE.;ORG.; BROAD INSTITUTE OF MIT AND HARVARD, CAMBRIDGE, MA 02142, USA; DEPARTMENT OF COMPUTER SCIENCE AND ENGINEERING, COLORADO MESA UNIVERSITY, GRAND JUNCTION, CO 81501, USA; COMPLEX SYSTEMS AND DATA SCIENCE PHD PROGRAM, UNIVERSITY OF VERMONT, BURLINGTON, VT 05405, USA; VERMONT COMPLEX SYSTEMS CENTER, UNIVERSITY OF VERMONT, BURLINGTON, VT 05405, USA.; ELECTRONIC ADDRESS: BLOFTNES@BROADINSTITUTE.;ORG.; BROAD INSTITUTE OF MIT AND HARVARD, CAMBRIDGE, MA 02142, USA.; HOWARD HUGHES MEDICAL INSTITUTE, CHEVY CHASE, MD 20815, USA.; BROAD INSTITUTE OF MIT AND HARVARD, CAMBRIDGE, MA 02142, USA.; DEGREE ANALYTICS, INC.;, AUSTIN, TX 78758, USA.; BROAD INSTITUTE OF MIT AND HARVARD, CAMBRIDGE, MA 02142, USA.; COLORADO MESA UNIVERSITY, GRAND JUNCTION, CO 81501, USA.; PROGRAM IN MOLECULAR MEDICINE, UNIVERSITY OF MASSACHUSETTS CHAN MEDICAL SCHOOL, WORCESTER, MA 01655, USA.; HARVARD PROGRAM IN BIOINFORMATICS AND INTEGRATIVE GENOMICS, HARVARD MEDICAL SCHOOL, BOSTON, MA 02115, USA.; COLORADO MESA UNIVERSITY, GRAND JUNCTION, CO 81501, USA.; PROGRAM IN MOLECULAR MEDICINE, UNIVERSITY OF MASSACHUSETTS CHAN MEDICAL SCHOOL, WORCESTER, MA 01655, USA.; BROAD INSTITUTE OF MIT AND HARVARD, CAMBRIDGE, MA 02142, USA.; BROAD INSTITUTE OF MIT AND HARVARD, CAMBRIDGE, MA 02142, USA.; BROAD INSTITUTE OF MIT AND HARVARD, CAMBRIDGE, MA 02142, USA.; BROAD INSTITUTE OF MIT AND HARVARD, CAMBRIDGE, MA 02142, USA.; DEPARTMENT OF CIVIL, ENVIRONMENTAL, AND ARCHITECTURAL ENGINEERING, UNIVERSITY OF COLORADO, BOULDER, CO 80309, USA.; COVIDCHECK COLORADO, LLC, DENVER, CO 80202, USA.; COLORADO MESA UNIVERSITY, GRAND JUNCTION, CO 81501, USA.; BROAD INSTITUTE OF MIT AND HARVARD, CAMBRIDGE, MA 02142, USA; PRINCETON UNIVERSITY MOLECULAR BIOLOGY DEPARTMENT, PRINCETON, NJ 08544, USA.; BROAD INSTITUTE OF MIT AND HARVARD, CAMBRIDGE, MA 02142, USA.; COLORADO MESA UNIVERSITY, GRAND JUNCTION, CO 81501, USA.; COLORADO MESA UNIVERSITY, GRAND JUNCTION, CO 81501, USA.; FATHOM INFORMATION DESIGN, BOSTON, MA 02114, USA.; BROAD INSTITUTE OF MIT AND HARVARD, CAMBRIDGE, MA 02142, USA.; FATHOM INFORMATION DESIGN, BOSTON, MA 02114, USA.; PROGRAM IN MOLECULAR MEDICINE, UNIVERSITY OF MASSACHUSETTS CHAN MEDICAL SCHOOL, WORCESTER, MA 01655, USA.; DEPARTMENT OF CIVIL, ENVIRONMENTAL, AND ARCHITECTURAL ENGINEERING, UNIVERSITY OF COLORADO, BOULDER, CO 80309, USA.; WARRIOR DIAGNOSTICS, INC.;, LOVELAND, CO 80538, USA.; COLORADO MESA UNIVERSITY, GRAND JUNCTION, CO 81501, USA.; BROAD INSTITUTE OF MIT AND HARVARD, CAMBRIDGE, MA 02142, USA.; FATHOM INFORMATION DESIGN, BOSTON, MA 02114, USA.; COLORADO MESA UNIVERSITY, GRAND JUNCTION, CO 81501, USA.; DEPARTMENT OF CIVIL, ENVIRONMENTAL, AND ARCHITECTURAL ENGINEERING, UNIVERSITY OF COLORADO, BOULDER, CO 80309, USA.; DEPARTMENT OF BIOLOGICAL SCIENCES, COLORADO MESA UNIVERSITY, GRAND JUNCTION, CO 81501, USA.; DEPARTMENT OF MATHEMATICS AND STATISTICS, COLORADO MESA UNIVERSITY, GRAND JUNCTION, CO 81501, USA.; BROAD INSTITUTE OF MIT AND HARVARD, CAMBRIDGE, MA 02142, USA.; FATHOM INFORMATION DESIGN, BOSTON, MA 02114, USA.; DEPARTMENT OF BIOLOGICAL SCIENCES, COLORADO MESA UNIVERSITY, GRAND JUNCTION, CO 81501, USA.; DEPARTMENT OF CIVIL, ENVIRONMENTAL, AND ARCHITECTURAL ENGINEERING, UNIVERSITY OF COLORADO, BOULDER, CO 80309, USA.; DEPARTMENT OF BIOLOGICAL SCIENCES, COLORADO MESA UNIVERSITY, GRAND JUNCTION, CO 81501, USA.; FATHOM INFORMATION DESIGN, BOSTON, MA 02114, USA.; BROAD INSTITUTE OF MIT AND HARVARD, CAMBRIDGE, MA 02142, USA.; FATHOM INFORMATION DESIGN, BOSTON, MA 02114, USA.; COLORADO MESA UNIVERSITY, GRAND JUNCTION, CO 81501, USA.; DEPARTMENT OF CIVIL, ENVIRONMENTAL, AND ARCHITECTURAL ENGINEERING, UNIVERSITY OF COLORADO, BOULDER, CO 80309, USA.; COLORADO MESA UNIVERSITY, GRAND JUNCTION, CO 81501, USA.; BROAD INSTITUTE OF MIT AND HARVARD, CAMBRIDGE, MA 02142, USA.; DEPARTMENT OF COMPUTER SCIENCE AND ENGINEERING, COLORADO MESA UNIVERSITY, GRAND JUNCTION, CO 81501, USA.; BROAD INSTITUTE OF MIT AND HARVARD, CAMBRIDGE, MA 02142, USA; UNIVERSITY OF MASSACHUSETTS MEDICAL SCHOOL, WORCESTER, MA 01655, USA.; BROAD INSTITUTE OF MIT AND HARVARD, CAMBRIDGE, MA 02142, USA.; DEPARTMENT OF BIOLOGICAL SCIENCES, COLORADO MESA UNIVERSITY, GRAND JUNCTION, CO 81501, USA.; COVIDCHECK COLORADO, LLC, DENVER, CO 80202, USA.; DEPARTMENT OF COMPUTER SCIENCE AND ENGINEERING, COLORADO MESA UNIVERSITY, GRAND JUNCTION, CO 81501, USA; DEPARTMENT OF CIVIL, ENVIRONMENTAL, AND ARCHITECTURAL ENGINEERING, UNIVERSITY OF COLORADO, BOULDER, CO 80309, USA.; BROAD INSTITUTE OF MIT AND HARVARD, CAMBRIDGE, MA 02142, USA; DEPARTMENT OF ORGANISMIC AND EVOLUTIONARY BIOLOGY, HARVARD UNIVERSITY, CAMBRIDGE, MA 02138, USA.; FATHOM INFORMATION DESIGN, BOSTON, MA 02114, USA.; BROAD INSTITUTE OF MIT AND HARVARD, CAMBRIDGE, MA 02142, USA; PROGRAM IN MOLECULAR MEDICINE, UNIVERSITY OF MASSACHUSETTS CHAN MEDICAL SCHOOL, WORCESTER, MA 01655, USA; BIOCHEMISTRY AND MOLECULAR PHARMACOLOGY, UNIVERSITY OF MASSACHUSETTS MEDICAL SCHOOL, WORCESTER, MA 01655, USA; MASSACHUSETTS CONSORTIUM ON PATHOGEN READINESS, BOSTON, MA 02115, USA.; BROAD INSTITUTE OF MIT AND HARVARD, CAMBRIDGE, MA 02142, USA.; COLORADO MESA UNIVERSITY, GRAND JUNCTION, CO 81501, USA.; PHYSICIAN ASSISTANT PROGRAM, DEPARTMENT OF KINESIOLOGY, COLORADO MESA UNIVERSITY, GRAND JUNCTION, CO 81501, USA.; BROAD INSTITUTE OF MIT AND HARVARD, CAMBRIDGE, MA 02142, USA.; BROAD INSTITUTE OF MIT AND HARVARD, CAMBRIDGE, MA 02142, USA; DEPARTMENT OF ORGANISMIC AND EVOLUTIONARY BIOLOGY, HARVARD UNIVERSITY, CAMBRIDGE, MA 02138, USA; HOWARD HUGHES MEDICAL INSTITUTE, CHEVY CHASE, MD 20815, USA; MASSACHUSETTS CONSORTIUM ON PATHOGEN READINESS, BOSTON, MA 02115, USA; DEPARTMENT OF EPIDEMIOLOGY, HARVARD T.;H.; CHAN SCHOOL OF PUBLIC HEALTH, BOSTON, MA 02115, USA.;","BROAD INSTITUTE OF MIT AND HARVARD;HARVARD-MIT PROGRAM IN HEALTH SCIENCES AND TECHNOLOGY;HARVARD/MIT MD-PHD PROGRAM;HARVARD MEDICAL SCHOOL;BROAD INSTITUTE OF MIT AND HARVARD;HARVARD MEDICAL SCHOOL;ELECTRONIC ADDRESS: JPAULL@BROADINSTITUTE.;BROAD INSTITUTE OF MIT AND HARVARD;HARVARD UNIVERSITY;ELECTRONIC ADDRESS: TOMKINSC@BROADINSTITUTE.;BROAD INSTITUTE OF MIT AND HARVARD;COLORADO MESA UNIVERSITY;UNIVERSITY OF VERMONT;UNIVERSITY OF VERMONT;ELECTRONIC ADDRESS: BLOFTNES@BROADINSTITUTE.;BROAD INSTITUTE OF MIT AND HARVARD;HOWARD HUGHES MEDICAL INSTITUTE;BROAD INSTITUTE OF MIT AND HARVARD;BROAD INSTITUTE OF MIT AND HARVARD;COLORADO MESA UNIVERSITY;UNIVERSITY OF MASSACHUSETTS CHAN MEDICAL SCHOOL;HARVARD MEDICAL SCHOOL;COLORADO MESA UNIVERSITY;UNIVERSITY OF MASSACHUSETTS CHAN MEDICAL SCHOOL;BROAD INSTITUTE OF MIT AND HARVARD;BROAD INSTITUTE OF MIT AND HARVARD;BROAD INSTITUTE OF MIT AND HARVARD;BROAD INSTITUTE OF MIT AND HARVARD;UNIVERSITY OF COLORADO;COLORADO MESA UNIVERSITY;BROAD INSTITUTE OF MIT AND HARVARD;PRINCETON UNIVERSITY MOLECULAR BIOLOGY DEPARTMENT;BROAD INSTITUTE OF MIT AND HARVARD;COLORADO MESA UNIVERSITY;COLORADO MESA UNIVERSITY;BROAD INSTITUTE OF MIT AND HARVARD;UNIVERSITY OF MASSACHUSETTS CHAN MEDICAL SCHOOL;UNIVERSITY OF COLORADO;COLORADO MESA UNIVERSITY;BROAD INSTITUTE OF MIT AND HARVARD;COLORADO MESA UNIVERSITY;UNIVERSITY OF COLORADO;COLORADO MESA UNIVERSITY;COLORADO MESA UNIVERSITY;BROAD INSTITUTE OF MIT AND HARVARD;COLORADO MESA UNIVERSITY;UNIVERSITY OF COLORADO;COLORADO MESA UNIVERSITY;BROAD INSTITUTE OF MIT AND HARVARD;COLORADO MESA UNIVERSITY;UNIVERSITY OF COLORADO;COLORADO MESA UNIVERSITY;BROAD INSTITUTE OF MIT AND HARVARD;COLORADO MESA UNIVERSITY;BROAD INSTITUTE OF MIT AND HARVARD;UNIVERSITY OF MASSACHUSETTS MEDICAL SCHOOL;BROAD INSTITUTE OF MIT AND HARVARD;COLORADO MESA UNIVERSITY;COLORADO MESA UNIVERSITY;UNIVERSITY OF COLORADO;BROAD INSTITUTE OF MIT AND HARVARD;HARVARD UNIVERSITY;BROAD INSTITUTE OF MIT AND HARVARD;UNIVERSITY OF MASSACHUSETTS CHAN MEDICAL SCHOOL;UNIVERSITY OF MASSACHUSETTS MEDICAL SCHOOL;MASSACHUSETTS CONSORTIUM ON PATHOGEN READINESS;BROAD INSTITUTE OF MIT AND HARVARD;COLORADO MESA UNIVERSITY;COLORADO MESA UNIVERSITY;BROAD INSTITUTE OF MIT AND HARVARD;BROAD INSTITUTE OF MIT AND HARVARD;HARVARD UNIVERSITY;HOWARD HUGHES MEDICAL INSTITUTE;MASSACHUSETTS CONSORTIUM ON PATHOGEN READINESS;CHAN SCHOOL OF PUBLIC HEALTH","PETROS BA, 2022, MED","PETROS BA, 2022, MED"
